Title;Subtitle;Image;Author;Publication;Year;Month;Day;Tag;Reading_Time;Claps;Comment;url;Author_urlThe Reason Youre Frustrated when Trying to Become a Data Scientist;The hidden skill that separates;1;Kurtis Pykes;Towards Data Science;2020;6;16;deep-learning;6;228;0;https://towardsdatascience.com/the-reason-youre-frustrated-when-trying-to-become-a-data-scientist-2d2b8b402811?source=tag_archive---------3-----------------------;https://towardsdatascience.com/@kurtispykes?source=tag_archive---------3-----------------------
How Trigo built a scalable AI development & deployment pipeline for Frictionless Retail;NaN;1;PyTorch;PyTorch;2020;6;16;deep-learning;8;632;0;https://medium.com/pytorch/how-trigo-built-a-scalable-ai-development-deployment-pipeline-for-frictionless-retail-b583d25d0dd?source=tag_archive---------4-----------------------;https://medium.com/@pytorch?source=tag_archive---------4-----------------------
Forecasting in Python with ESRNN model;Pytorch implementation of the ESRNN, winning submission of the;1;Federico Garza Ram rez;Analytics Vidhya;2020;6;16;deep-learning;7;79;0;https://medium.com/analytics-vidhya/forecasting-in-python-with-esrnn-model-75f7fae1d242?source=tag_archive---------5-----------------------;https://medium.com/@fede.garza.ramirez?source=tag_archive---------5-----------------------
 Transformer [Part I];   ;1;Pakawat Nakwijit;NaN;2020;6;16;deep-learning;4;203;0;https://medium.com/@chameleontk/%E0%B8%97%E0%B8%B3%E0%B8%84%E0%B8%A7%E0%B8%B2%E0%B8%A1%E0%B9%80%E0%B8%82%E0%B9%89%E0%B8%B2%E0%B9%83%E0%B8%88-transformer-part-i-a50dcf06579b?source=tag_archive---------6-----------------------;https://medium.com/@chameleontk?source=tag_archive---------6-----------------------
Why we need person re-identification?;An in-depth look into identifying people from different angles;1;German Sharabok;Towards Data Science;2020;6;16;deep-learning;5;55;0;https://towardsdatascience.com/why-we-need-person-re-identification-3a45d170098b?source=tag_archive---------7-----------------------;https://towardsdatascience.com/@gsharabok?source=tag_archive---------7-----------------------
Classify Your Images using a Convolutional Neural Network;Build a CNN from scratch to classify images;1;Dinesh Kumar Chinnasamy;Towards Data Science;2020;6;16;deep-learning;6;5;0;https://towardsdatascience.com/classify-your-images-using-convolutional-neural-network-4b54989d93dd?source=tag_archive---------8-----------------------;https://towardsdatascience.com/@dineshkumr.c?source=tag_archive---------8-----------------------
Lecture Notes in Deep Learning: IntroductionPart 1;Motivation & High Profile Applications;1;Andreas Maier;Towards Data Science;2020;6;16;deep-learning;12;75;0;https://towardsdatascience.com/lecture-notes-in-deep-learning-introduction-part-1-5a1729abd580?source=tag_archive---------9-----------------------;https://towardsdatascience.com/@akmaier?source=tag_archive---------9-----------------------
Labelling unstructured text data in Python;Labelled data has been a crucial demand for supervised;1;Rishabh Dwivedi;Brillio Data Science;2020;6;16;deep-learning;4;65;0;https://medium.com/brillio-data-science/labelling-unstructured-text-data-in-python-974e809b98d9?source=tag_archive---------10-----------------------;https://medium.com/@dwivedi.rishabh1995?source=tag_archive---------10-----------------------
Conversion of RGB images to Hyperspectral using Deep learning;NaN;1;Rishabh Karmakar;Analytics Vidhya;2020;6;16;deep-learning;8;13;0;https://medium.com/analytics-vidhya/conversion-of-rgb-images-to-hyperspectral-using-deep-learning-f3dff0a1d60a?source=tag_archive---------11-----------------------;https://medium.com/@rishabh.rk1705?source=tag_archive---------11-----------------------
Deep Learning Sound Classification Model;Sound is energy made by vibrations. And these vibrations are the fact to distinguish the;1;Akash Varshney;AkashVarshney;2020;6;16;deep-learning;5;19;0;https://medium.com/akashvarshney/deep-learning-sound-classification-model-e344ea84f97b?source=tag_archive---------12-----------------------;https://medium.com/@akashvarshney?source=tag_archive---------12-----------------------
Quantum Computing for Students of Machine Learning;A gentle intro into quantum computing from a;1;Vinayak Sharma;SyntechX;2020;6;16;deep-learning;10;103;0;https://medium.com/syntechx/quantum-computing-for-students-of-machine-learning-7643cebc77f0?source=tag_archive---------13-----------------------;https://medium.com/@vinayak1998th?source=tag_archive---------13-----------------------
GANsConditional GANs with MNIST (Part 4);Brief theoretical introduction to Conditional Generative Adversarial Nets or CGANs;1;fernanda rodr guez;NaN;2020;6;16;deep-learning;4;21;0;https://medium.com/@mafda_/gans-conditional-gans-with-mnist-part-4-7f816d274d8c?source=tag_archive---------14-----------------------;https://medium.com/@mafda_?source=tag_archive---------14-----------------------
GANs Wasserstein GAN with MNIST (Part 6);practical;1;fernanda rodr guez;NaN;2020;6;16;deep-learning;3;3;0;https://medium.com/@mafda_/gans-wasserstein-gan-with-mnist-part-6-7f796a0cea47?source=tag_archive---------15-----------------------;https://medium.com/@mafda_?source=tag_archive---------15-----------------------
Two Types of Adversarial Attacks that Any Data Scientist Should Know About;White-Box and Black-Box;0;Jesus Rodriguez;The Startup;2020;6;16;deep-learning;4;57;0;https://medium.com/swlh/two-types-of-adversarial-attacks-that-any-data-scientist-should-know-c7cee943f480?source=tag_archive---------16-----------------------;https://medium.com/@jrodthoughts?source=tag_archive---------16-----------------------
Demystifying the GAN using a 1D Function (Keras);NaN;1;SubTain Malik;Analytics Vidhya;2020;6;16;deep-learning;4;2;0;https://medium.com/analytics-vidhya/demystifying-the-gan-using-a-1d-function-keras-bc7b861bb304?source=tag_archive---------17-----------------------;https://medium.com/@m3sibti?source=tag_archive---------17-----------------------
Lecture Notes in Deep Learning: IntroductionPart 2;Highlights at FAU;1;Andreas Maier;Towards Data Science;2020;6;16;deep-learning;14;113;0;https://towardsdatascience.com/lecture-notes-in-deep-learning-introduction-part-2-acabbb3ad22?source=tag_archive---------18-----------------------;https://towardsdatascience.com/@akmaier?source=tag_archive---------18-----------------------
GANsGenerative Adversarial Networks;A dive into the magical world of deep learning, unlocking the;1;Nirav Agarwal;Towards Data Science;2020;6;16;deep-learning;6;36;0;https://towardsdatascience.com/gans-generative-adversarial-networks-db42fe064f58?source=tag_archive---------19-----------------------;https://towardsdatascience.com/@niravagarwal?source=tag_archive---------19-----------------------
An Introduction and Roadmap to Natural Language Processing.;In the journey of a Data Science Student;1;Dijoraj Sen Roy;Unknownimous;2020;6;16;deep-learning;10;199;0;https://medium.com/unknownimous/an-introduction-and-roadmap-to-natural-language-processing-8956874b330d?source=tag_archive---------20-----------------------;https://medium.com/@srdijoraj?source=tag_archive---------20-----------------------
Plant Leaf Classification Using Deep Learning, Transfer Learning and ML Algorithms;NaN;1;Vibhav Sharma;The Startup;2020;6;16;deep-learning;5;106;0;https://medium.com/swlh/plant-leaf-classification-using-deep-learning-transfer-learning-and-ml-algorithms-a840aa4c353f?source=tag_archive---------21-----------------------;https://medium.com/@vibchess123?source=tag_archive---------21-----------------------
CNN Deep-Learning with GPU in Elixir;Finally DeepPipe2 has started learning with CIFAR10. DeepPipe2 is a Deep-Learning framework by;1;Kenichi Sasagawa;NaN;2020;6;16;deep-learning;3;14;0;https://medium.com/@kenichisasagawa/cnn-deep-learning-with-gpu-in-elixir-f0dc76630723?source=tag_archive---------22-----------------------;https://medium.com/@kenichisasagawa?source=tag_archive---------22-----------------------
Neural Networks (Part 1);NaN;1;Ahmed Imam;The Startup;2020;6;16;deep-learning;6;54;0;https://medium.com/swlh/neural-networks-4b6f719f9d75?source=tag_archive---------23-----------------------;https://medium.com/@ah-im-mo7?source=tag_archive---------23-----------------------
Neural Networks Part 2: Building Neural Networks & Understanding Gradient Descent.;NaN;1;Shweta Kadam;Analytics Vidhya;2020;6;16;deep-learning;8;195;0;https://medium.com/analytics-vidhya/neural-networks-part-2-building-neural-networks-understanding-gradient-descent-145718e91270?source=tag_archive---------24-----------------------;https://medium.com/@shwetarkadam25?source=tag_archive---------24-----------------------
Reading: FishNet / FishNeXtA Versatile Backbone for Image, Region, and Pixel Level Prediction (Image;NaN;1;Sik-Ho Tsang;NaN;2020;6;16;deep-learning;4;34;0;https://medium.com/@sh-tsang/reading-fishnet-fishnext-a-versatile-backbone-for-image-region-and-pixel-level-prediction-a5f9aa91f96b?source=tag_archive---------25-----------------------;https://medium.com/@sh-tsang?source=tag_archive---------25-----------------------
What distinguishes a neural network that generalizes well from those that dont?;Understanding Deep;1;Ratul Ghosh;Towards Data Science;2020;6;16;deep-learning;6;13;0;https://towardsdatascience.com/what-distinguishes-a-neural-network-that-generalizes-well-from-those-that-dont-8954f741d533?source=tag_archive---------26-----------------------;https://towardsdatascience.com/@ratulghoshr?source=tag_archive---------26-----------------------
How Neural Networks Learn;THE FEEFFORWARD BACKPROPAGATION ALGORITHM DERIVED FROM SCRATCH;1;Ani Karenovna K;Level Up Coding;2020;6;16;deep-learning;11;6;0;https://levelup.gitconnected.com/how-neural-networks-learn-f602d6f77a13?source=tag_archive---------27-----------------------;https://levelup.gitconnected.com/@karenovna.ak?source=tag_archive---------27-----------------------
Feature extraction in EEG signals;An end to end guide on extracting the features from EEG signals using various techniques like Fast;1;Kalaivaani Natarajan;NaN;2020;6;16;deep-learning;5;2;0;https://medium.com/@kalaivaaninatarajan/feature-extraction-in-eeg-signals-f8e5dfb94cdf?source=tag_archive---------28-----------------------;https://medium.com/@kalaivaaninatarajan?source=tag_archive---------28-----------------------
Genetic Algorithms: Biologically-Inspired Deep Learning Optimization;NaN;1;Mihir Parmar;ML Brew;2020;6;16;deep-learning;5;89;0;https://medium.com/ml-brew/genetic-algorithms-biologically-inspired-deep-learning-optimization-e4125e04053?source=tag_archive---------29-----------------------;https://medium.com/@freethinker.technophile?source=tag_archive---------29-----------------------
NaN;NaN;1;Bob Rupak Roy;Data2Dimensions Rupak Bob Roy;2020;6;16;deep-learning;9;1;0;https://medium.com/data2dimensions-rupak-bob-roy/lets-develop-artificial-neural-network-in-30-lines-of-code-ii-76a9e1f93566?source=tag_archive---------30-----------------------;https://medium.com/@bob-rupak-roy?source=tag_archive---------30-----------------------
Classifying Text Data into Multiple Categories;Single-Label Multi-class Classification;1;Jake Batsuuri;NaN;2020;6;16;deep-learning;5;73;0;https://medium.com/@tbatsorry/classifying-text-data-into-multiple-categories-4241dc44c97a?source=tag_archive---------31-----------------------;https://medium.com/@tbatsorry?source=tag_archive---------31-----------------------
GANsLeast Squares GANs with MNIST (Part 7);Brief theoretical introduction to Least Squares Generative Adversarial Nets or;1;fernanda rodr guez;NaN;2020;6;16;deep-learning;3;0;0;https://medium.com/@mafda_/gans-least-squares-gans-with-mnist-part-7-e6cf2fff503c?source=tag_archive---------32-----------------------;https://medium.com/@mafda_?source=tag_archive---------32-----------------------
Appearance Invariant Face Verification using Deep Learning!;Face verification is a one-to-one mapping of a given face;1;Siddharth Dayalwal;NaN;2020;6;16;deep-learning;4;3;0;https://medium.com/@siddharthdayalwal/appearance-invariant-face-verification-using-deep-learning-d61ace4ddb83?source=tag_archive---------33-----------------------;https://medium.com/@siddharthdayalwal?source=tag_archive---------33-----------------------
Trying to contribute to the fight against waste pollution with Computer VisionPart I;NaN;1;Picsell.ia;Becoming Human: Artificial Intelligence Magazine;2020;6;16;deep-learning;4;52;0;https://becominghuman.ai/trying-to-contribute-to-the-fight-against-waste-pollution-with-computer-vision-part-i-fc955982af9a?source=tag_archive---------34-----------------------;https://becominghuman.ai/@thibautlucas13?source=tag_archive---------34-----------------------
GANsDeep Convolutional GANs with CIFAR10 (Part 8);NaN;1;fernanda rodr guez;NaN;2020;6;16;deep-learning;3;0;0;https://medium.com/@mafda_/gans-deep-convolutional-gans-with-cifar10-part-8-be881a77e55b?source=tag_archive---------35-----------------------;https://medium.com/@mafda_?source=tag_archive---------35-----------------------
El humanismo y la inteligencia artificial;Existen varios debates que han surgido desde la concepcin de la posibilidad de dar;1;Carlos Villegas;Planeta Chatbot todo sobre los Chat bots, Voice apps e Inteligencia Artificial;2020;6;16;deep-learning;5;0;0;https://planetachatbot.com/humanismo-y-inteligencia-artificial-fd080214cec8?source=tag_archive---------36-----------------------;https://planetachatbot.com/@novfrost85?source=tag_archive---------36-----------------------
Network Traffic Classification in SDN using Machine learning and Deep learning techniques;NaN;1;Samarth Sharma;NaN;2020;6;16;deep-learning;3;7;0;https://medium.com/@samarthsharma_41447/network-traffic-classification-in-sdn-using-machine-learning-and-deep-learning-techniques-b54eeca0bfa7?source=tag_archive---------37-----------------------;https://medium.com/@samarthsharma_41447?source=tag_archive---------37-----------------------
Particle Detectors & Calorimetry;NaN;1;Abdalaziz Rashid;The Startup;2020;6;16;deep-learning;9;103;0;https://medium.com/swlh/particle-detectors-calorimetry-b7d9c3998dd9?source=tag_archive---------38-----------------------;https://medium.com/@abd.aziz89?source=tag_archive---------38-----------------------
Generating quirky things with Recurrent Neural Nets;NaN;1;Saksham Bassi;Analytics Vidhya;2020;6;16;deep-learning;5;137;0;https://medium.com/analytics-vidhya/generating-quirky-things-with-recurrent-neural-nets-4c0c8749cdf0?source=tag_archive---------39-----------------------;https://medium.com/@sakshambassi?source=tag_archive---------39-----------------------
HOW DEEP REINFORCEMENT LEARNING IS USED FOR LOCOMOTION SKILL IN ROBOTICS?;Experts believe that deep;1;Manuelgeorgethomas;NaN;2020;6;16;deep-learning;5;3;0;https://medium.com/@manuelgeorgethomas/how-deep-reinforcement-learning-is-used-for-locomotion-skill-in-robotics-9130865c3f06?source=tag_archive---------40-----------------------;https://medium.com/@manuelgeorgethomas?source=tag_archive---------40-----------------------
GANsContext-Conditional GANs with MNIST (Part 5);NaN;1;fernanda rodr guez;NaN;2020;6;16;deep-learning;4;0;0;https://medium.com/@mafda_/gans-context-conditional-gans-with-mnist-part-5-a8d56a243377?source=tag_archive---------41-----------------------;https://medium.com/@mafda_?source=tag_archive---------41-----------------------
Dployer ma premire application de Deep Learning;Suite du mooc de Udacity sur un projet deep learning;1;Maxime Pawlak;NaN;2020;6;16;deep-learning;6;6;0;https://medium.com/@Maxime_/d%C3%A9ployer-ma-premi%C3%A8re-application-de-deep-learning-4a2a88e85297?source=tag_archive---------42-----------------------;https://medium.com/@Maxime_?source=tag_archive---------42-----------------------
Separation Of Music and Voice Using Deep Learning;NaN;1;Navneet Agarwal;NaN;2020;6;16;deep-learning;4;346;0;https://medium.com/@navneet.agarwal.97521/separation-of-music-and-voice-using-deep-learning-ef322ba00d50?source=tag_archive---------43-----------------------;https://medium.com/@navneet.agarwal.97521?source=tag_archive---------43-----------------------
Neural Networks From Scratch Series;The Mathematics Behind Neural Networks;1;Ani Karenovna K;NaN;2020;6;16;deep-learning;2;16;0;https://medium.com/@karenovna.ak/neural-networks-from-scratch-series-c969ba5b4e2b?source=tag_archive---------44-----------------------;https://medium.com/@karenovna.ak?source=tag_archive---------44-----------------------
One Shot FootPrint Recognition Using PyTorch;So till now we have seen advancements in fingerprint recognition techniques using;1;C S Karthik;Analytics Vidhya;2020;6;16;deep-learning;3;69;0;https://medium.com/analytics-vidhya/footprint-recognition-using-one-shot-learning-using-pytorch-ed52062f75af?source=tag_archive---------45-----------------------;https://medium.com/@cskarthik0908?source=tag_archive---------45-----------------------
GANsConditional GANs with CIFAR10 (Part 9);Brief theoretical introduction to Conditional Generative Adversarial Nets or;1;fernanda rodr guez;NaN;2020;6;16;deep-learning;4;1;0;https://medium.com/@mafda_/gans-conditional-gans-with-cifar10-part-9-8e47373e33b8?source=tag_archive---------46-----------------------;https://medium.com/@mafda_?source=tag_archive---------46-----------------------
Reading: AResNetAttention Residual Neural Network (Codec Filtering);2.77%, 7.01%, 8.64% BD-Rate;1;Sik-Ho Tsang;NaN;2020;6;16;deep-learning;4;18;0;https://medium.com/@sh-tsang/reading-aresnet-attention-residual-neural-network-codec-filtering-980979530c28?source=tag_archive---------47-----------------------;https://medium.com/@sh-tsang?source=tag_archive---------47-----------------------
SOCIAL MEDIA NEWS GENERATION;Nowadays people communicate and share their ideas, emotions, knowledge and personal opinions on various;1;Puthali Ravella;NaN;2020;6;16;deep-learning;5;8;0;https://medium.com/@puthaliravella/social-media-news-generation-aa1f9d254355?source=tag_archive---------48-----------------------;https://medium.com/@puthaliravella?source=tag_archive---------48-----------------------
Deployment of deep learning models on mobile and edge devices;We are in the era of deep learning and;1;Devdatta khoche;NaN;2020;6;16;deep-learning;4;2;0;https://medium.com/@dkhoche2000/deployment-of-deep-learning-models-on-mobile-and-edge-devices-2763b8d9d3d3?source=tag_archive---------49-----------------------;https://medium.com/@dkhoche2000?source=tag_archive---------49-----------------------
Random Forest Classification and its Mathematical Implementation;NaN;1;RAHUL RASTOGI;Analytics Vidhya;2020;6;16;deep-learning;4;0;0;https://medium.com/analytics-vidhya/random-forest-classification-and-its-mathematical-implementation-1895a7bb743e?source=tag_archive---------50-----------------------;https://medium.com/@rahulrastogi1104?source=tag_archive---------50-----------------------
Identifying and Classification of Singularity Patterns from fingerprint using transfer learning and Pytorch;NaN;1;Gunish Jain;NaN;2020;6;16;deep-learning;4;0;0;https://medium.com/@gunishjain/identifying-and-classification-of-singularity-patterns-from-fingerprint-using-transfer-learning-95f55096a710?source=tag_archive---------51-----------------------;https://medium.com/@gunishjain?source=tag_archive---------51-----------------------
DatasetMicrosoft COCO: Common Objects in Context;Introduction to Microsoft COCO: Common Objects in Context;0;Yanwei Liu;NaN;2020;6;16;deep-learning;1;0;0;https://medium.com/@yanwei-liu/intro-to-computer-vision-dataset-ms-coco-11dc365a5bf5?source=tag_archive---------52-----------------------;https://medium.com/@yanwei-liu?source=tag_archive---------52-----------------------
FAKENESS FAKENESS EVERYWHERE!!!;It is difficult to find people without having masks on. Similarly, it happens in the case of news too;1;Merin Annie Vincent;NaN;2020;6;16;deep-learning;4;102;0;https://medium.com/@merin.css1921/fakeness-fakeness-everywhere-bdd42ecf9eb5?source=tag_archive---------53-----------------------;https://medium.com/@merin.css1921?source=tag_archive---------53-----------------------
SOCIAL MEDIA NEWS GENERATION;Nowadays people communicate and share their ideas, emotions, knowledge and personal opinions on various;1;simna ashraf;NaN;2020;6;16;deep-learning;5;52;0;https://medium.com/@simnaashraf7/social-media-news-generation-2d7db2d5f18a?source=tag_archive---------54-----------------------;https://medium.com/@simnaashraf7?source=tag_archive---------54-----------------------
Deep Learning Style Transfer;Today we cover Tensorflow notebook to understand more deeply the issue of style transfer. the main idea is to;1;Michael Sheinfeild;NaN;2020;6;16;deep-learning;2;1;0;https://medium.com/@michaelsheinfeild/deep-learning-style-transfer-587039370003?source=tag_archive---------55-----------------------;https://medium.com/@michaelsheinfeild?source=tag_archive---------55-----------------------
Artificial Intelligence, Machine Learning and Deep Learning;NaN;1;Malcolm Staso;NaN;2020;6;16;deep-learning;3;0;0;https://medium.com/@mstaso1/artificial-intelligence-machine-learning-and-deep-learning-50d7fc9b24a8?source=tag_archive---------56-----------------------;https://medium.com/@mstaso1?source=tag_archive---------56-----------------------
Seeing What Was Invisible: How AI WorksAI for Application Developers Pt. 3;NaN;1;Tim Kiely;NaN;2020;6;16;deep-learning;10;0;0;https://medium.com/@thetimkiely/seeing-what-was-invisible-how-ai-works-ai-for-application-developers-pt-3-d28c3f1c104e?source=tag_archive---------57-----------------------;https://medium.com/@thetimkiely?source=tag_archive---------57-----------------------
(18)Natural Language Processing;Introduction to Natural Language Processing;0;Yanwei Liu;NaN;2020;6;16;deep-learning;0;0;0;https://medium.com/@yanwei-liu/introduction-to-natural-language-processing-76766722961a?source=tag_archive---------58-----------------------;https://medium.com/@yanwei-liu?source=tag_archive---------58-----------------------
NaN;The crave of processing power for AI progress;0;Deepak Singh;NaN;2020;6;16;deep-learning;4;0;0;https://medium.com/@deepaksingh-rv/todays-supercomputers-will-be-tomorrow-s-wristwatches-8b502edea33a?source=tag_archive---------59-----------------------;https://medium.com/@deepaksingh-rv?source=tag_archive---------59-----------------------
Annotating Wildfire Smoke Images;Thank you our volunteers in annotating a new set of wildfire smoke images! Great effort by our;1;AI For Mankind;NaN;2020;6;16;deep-learning;1;0;0;https://medium.com/@ai.for.mankind/annotating-wildfire-smoke-images-ffd8a9dee2cc?source=tag_archive---------60-----------------------;https://medium.com/@ai.for.mankind?source=tag_archive---------60-----------------------
CTRMRadio Edition 15Improved energy demand forecasting using Deep Learning Technology;In this episode of CTRMRadio, we examine a real world use of artificial intelligence (more specifically deep learning) in the energy trading markets. We visit with two experts;0;CTRM Center;NaN;2020;6;16;deep-learning;1;0;0;https://medium.com/@ctrmcenter/ctrmradio-edition-15-improved-energy-demand-forecasting-using-deep-learning-technology-5d7f6ba5093c?source=tag_archive---------61-----------------------;https://medium.com/@ctrmcenter?source=tag_archive---------61-----------------------
NaN;NaN;0;Mirali Purohit;NaN;2020;6;16;deep-learning;0;10;1;https://medium.com/ml-brew/genetic-algorithms-biologically-inspired-deep-learning-optimization-e4125e04053?source=tag_archive---------62-----------------------;https://medium.com/@purohitmirali33?source=tag_archive---------62-----------------------
Por qu no podemos despegarnos de TikTok?Brain Boost;En estos tiempos de encierro, seguramente te;1;Juan Carlos Rodr guez Gzmn.;NaN;2020;6;16;deep-learning;6;0;0;https://medium.com/@juang3ac/por-qu%C3%A9-no-podemos-despegarnos-de-tiktok-brain-boost-a05e16bd7ebd?source=tag_archive---------63-----------------------;https://medium.com/@juang3ac?source=tag_archive---------63-----------------------
Real time face recognition with Android + TensorFlow Lite;NaN;1;esteban uri;NaN;2020;6;17;deep-learning;11;303;0;https://medium.com/@estebanuri/real-time-face-recognition-with-android-tensorflow-lite-14e9c6cc53a5?source=tag_archive---------0-----------------------;https://medium.com/@estebanuri?source=tag_archive---------0-----------------------
The online courses you must take to be a better Data Scientist;There are lots of them but which ones;1;David Adri n Ca ones;DataTau;2020;6;17;deep-learning;9;1.2K;0;https://medium.com/datatau/the-online-courses-you-must-take-to-be-a-better-data-scientist-36a06016c819?source=tag_archive---------1-----------------------;https://medium.com/@dcanones?source=tag_archive---------1-----------------------
A social distancing detector using a Tensorflow object detection model, Python and OpenCV.;NaN;1;Basile Roth;Towards Data Science;2020;6;17;deep-learning;8;447;0;https://towardsdatascience.com/a-social-distancing-detector-using-a-tensorflow-object-detection-model-python-and-opencv-4450a431238?source=tag_archive---------2-----------------------;https://towardsdatascience.com/@basileroth.75?source=tag_archive---------2-----------------------
Entropy, Cross-Entropy, and KL-Divergence Explained!;Let us try to understand the most widely used;1;Aakarsh Yelisetty;Towards Data Science;2020;6;17;deep-learning;8;444;0;https://towardsdatascience.com/entropy-cross-entropy-and-kl-divergence-explained-b09cdae917a?source=tag_archive---------3-----------------------;https://towardsdatascience.com/@aakarsh0705?source=tag_archive---------3-----------------------
