Title;Subtitle;Image;Author;Publication;Year;Month;Day;Tag;Reading_Time;Claps;Comment;url;Author_url
Lets Code Convolutional Neural Network in plain NumPy;Mysteries of Neural Networks;1;Piotr Skalski;Towards Data Science;2020;6;1;deep-learning;10;824;0;https://towardsdatascience.com/lets-code-convolutional-neural-network-in-plain-numpy-ce48e732f5d5?source=tag_archive---------0-----------------------;https://towardsdatascience.com/@piotr.skalski92?source=tag_archive---------0-----------------------
Building a Text Classification model using BiLSTM;NaN;1;Pashupati Gupta;Analytics Vidhya;2020;6;1;deep-learning;9;89;0;https://medium.com/analytics-vidhya/building-a-text-classification-model-using-bilstm-c0548ace26f2?source=tag_archive---------1-----------------------;https://medium.com/@pashupatigupta1998?source=tag_archive---------1-----------------------
NaN;NaN;1;Jordi TORRES.AI;Towards Data Science;2020;6;1;deep-learning;16;11;0;https://towardsdatascience.com/deep-learning-with-pytorch-a93b09bdae96?source=tag_archive---------2-----------------------;https://towardsdatascience.com/@torres-ai?source=tag_archive---------2-----------------------
Introduction to Deep Similarity Learning for sequences;The first part of a series of in-depth reviews;1;Thomas Di Martino;Towards Data Science;2020;6;1;deep-learning;6;38;0;https://towardsdatascience.com/introduction-to-deep-similarity-learning-for-sequences-89d9c26f8392?source=tag_archive---------3-----------------------;https://towardsdatascience.com/@dimartinot?source=tag_archive---------3-----------------------
Using Skip Connections To Enhance Denoising Autoencoder Algorithms;Comparing the denoising;1;Metika Sikka;Towards Data Science;2020;6;1;deep-learning;8;89;0;https://towardsdatascience.com/using-skip-connections-to-enhance-denoising-autoencoder-algorithms-849e049c0ac9?source=tag_archive---------4-----------------------;https://towardsdatascience.com/@metika?source=tag_archive---------4-----------------------
End-to-End Object Detection with Transformers;Human attention mechanism is obtained from intuition. It is a means for humans;1;Nabil MADALI;The Startup;2020;6;1;deep-learning;5;186;0;https://medium.com/swlh/end-to-end-object-detection-with-transformers-95710b5eff32?source=tag_archive---------5-----------------------;https://medium.com/@nabil.madali?source=tag_archive---------5-----------------------
Train your dog using TF-Agents;NaN;1;Kshitiz Rimal;Deep Learning Journal;2020;6;1;deep-learning;16;82;0;https://medium.com/deep-learning-journals/train-your-dog-using-tf-agents-fba297a85baa?source=tag_archive---------6-----------------------;https://medium.com/@kshitizrimal?source=tag_archive---------6-----------------------
Convolutional Neural Network Champions Part  1: LeNet-5;The multiple-part series on the most popular;1;Amir Nejad;Towards Data Science;2020;6;1;deep-learning;17;6;0;https://towardsdatascience.com/convolutional-neural-network-champions-part-1-lenet-5-7a8d6eb98df6?source=tag_archive---------7-----------------------;https://towardsdatascience.com/@amirnejad?source=tag_archive---------7-----------------------
DETR, Object detection with Transformer;"TL; DR";1;Neil Wu;LSC PSD;2020;6;1;deep-learning;3;33;0;https://medium.com/lsc-psd/detr-object-detection-with-transformer-a97104ea1723?source=tag_archive---------8-----------------------;https://medium.com/@neilctwu?source=tag_archive---------8-----------------------
FaceMask Detection using Tensorflow and OpenCV;Effective realtime facemask detection;1;Manas Acharya;Towards Data Science;2020;6;1;deep-learning;4;11;0;https://towardsdatascience.com/facemask-detection-using-tensorflow-and-opencv-824b69cad837?source=tag_archive---------9-----------------------;https://towardsdatascience.com/@manasbass.99?source=tag_archive---------9-----------------------
Stochastic Gradient Descent for machine learning clearly explained;Stochastic Gradient Descent is;1;Baptiste Monpezat;Towards Data Science;2020;6;1;deep-learning;7;131;0;https://towardsdatascience.com/stochastic-gradient-descent-for-machine-learning-clearly-explained-cadcc17d3d11?source=tag_archive---------10-----------------------;https://towardsdatascience.com/@baptiste.monpezat?source=tag_archive---------10-----------------------
Building a Simple Neural Network from Scratch;All you need to know about implementing a simple neural;1;Akarsh Saxena;Towards Data Science;2020;6;1;deep-learning;8;118;0;https://towardsdatascience.com/building-a-simple-neural-network-from-scratch-a5c6b2eb0c34?source=tag_archive---------11-----------------------;https://towardsdatascience.com/@akarsh.saxena?source=tag_archive---------11-----------------------
Document scanner and private data sharing;Change perspective of an imagetake a picture of a;1;Simeon Emanuilov;Towards Data Science;2020;6;1;deep-learning;11;54;0;https://towardsdatascience.com/document-scanner-and-private-data-sharing-2fb82b3f0fbb?source=tag_archive---------12-----------------------;https://towardsdatascience.com/@simeon.emanuilov?source=tag_archive---------12-----------------------
NaN;NaN;1;hrishabh digaari;Towards Data Science;2020;6;1;deep-learning;5;288;0;https://towardsdatascience.com/things-i-wish-i-had-known-how-to-build-a-machine-learning-web-app-without-rest-api-f6ead0d058a6?source=tag_archive---------13-----------------------;https://towardsdatascience.com/@hrishabhdigaari?source=tag_archive---------13-----------------------
Principios en Inteligencia Artificial (Parte 1);Este post es un resumen y anlisis del reporte Principled Artificial Intelligence: Mapping Consensus in Ethical and Rights-based Approaches to Principles for AI hecho por el centro de investigacin Berkman Klein Center for Internet & Society de;0;Michelle D az;AI Learners;2020;6;1;deep-learning;11;154;0;https://medium.com/ai-learners/principios-en-inteligencia-artificial-parte-1-ai-learners-3d68c2b051f3?source=tag_archive---------14-----------------------;https://medium.com/@michellediazvi?source=tag_archive---------14-----------------------
Deploy Deep Learning Model  Production Environment;NaN;1;Chalach Monkhontirapat;Equinox;2020;6;1;deep-learning;3;102;0;https://medium.com/equinox-blog/deploy-deep-learning-model-%E0%B8%9A%E0%B8%99-production-environment-75aa46bf4de?source=tag_archive---------15-----------------------;https://medium.com/@Chalach.mo?source=tag_archive---------15-----------------------
Private ML with Tensorflow privacy;Building your first privacy-preserving model with TF-Privacy;1;Fabiana Clemente;YData;2020;6;1;deep-learning;6;15;0;https://medium.com/ydata-ai/private-ml-with-tensorflow-privacy-9122f3340a9b?source=tag_archive---------16-----------------------;https://medium.com/@fabiana_clemente?source=tag_archive---------16-----------------------
Deep Learning in JavaScript (Part 2);Hand-drawn character recognition using TensorFlow.js;1;Rising Odegua;Heartbeat;2020;6;1;deep-learning;11;103;0;https://heartbeat.fritz.ai/deep-learning-in-javascript-part-2-a2823defd3d9?source=tag_archive---------17-----------------------;https://heartbeat.fritz.ai/@risingdeveloper?source=tag_archive---------17-----------------------
Derin renmeGiri;Derin renme, Makine renmesi(Machine Learning) konusundaki en popler balktr. Olduka kapsaml ve alt dallar;1;Engin UNAL;NaN;2020;6;1;deep-learning;9;73;0;https://medium.com/@enginunal/derin-%C3%B6%C4%9Frenme-giri%C5%9F-dad1a98241d0?source=tag_archive---------18-----------------------;https://medium.com/@enginunal?source=tag_archive---------18-----------------------
Machine LearningPyTorch;Explore Some PyTorch functions for tensor operations;1;Bharat Kabra;xyzeelearn;2020;6;1;deep-learning;5;108;0;https://medium.com/xyzeelearn/machine-learning-pytorch-590b09409236?source=tag_archive---------19-----------------------;https://medium.com/@bharat.kabra?source=tag_archive---------19-----------------------
Review On YOLOv1;YOLO stands for You Only Look Once. As the name says, network only looks the image once to detect multiple objects. The main;1;Arun Mohan;Data Driven Investor;2020;6;1;deep-learning;7;300;0;https://medium.com/datadriveninvestor/review-on-yolov1-3c85304b617d?source=tag_archive---------20-----------------------;https://medium.com/@arunm8489?source=tag_archive---------20-----------------------
Using PYTHON Pandas DataFrame;A data frame is a two-dimensional data structure, that is, the data is aligned in rows and columns in a;1;Furkan Gulsen;Analytics Vidhya;2020;6;1;deep-learning;3;10;0;https://medium.com/analytics-vidhya/using-python-pandas-dataframe-820182b0a747?source=tag_archive---------21-----------------------;https://medium.com/@furkangulsen?source=tag_archive---------21-----------------------
Derin renme Mimarileri;Dnya apnda bir yarma olan ImageNet yarmas ile birlikte daha da rekabeti bir hale gelen derin renme;1;Dr. Serkan Sava ;Yapay Zeka, Makine renmesi, Derin renme;2020;6;1;deep-learning;5;0;0;https://medium.com/yapay-zeka-makine-%C3%B6%C4%9Frenmesi-derin-%C3%B6%C4%9Frenme/derin-%C3%B6%C4%9Frenme-mimarileri-ce3c16a22ffc?source=tag_archive---------22-----------------------;https://medium.com/@serkansavas?source=tag_archive---------22-----------------------
NVIDIAs new Jetson Xavier NX compared to Jetson TX2 and Jetson NanoWhich is the Worlds Smallest AI;NaN;1; Sebastian Weiss;3dvisionlabs;2020;6;1;deep-learning;6;3;0;https://medium.com/3dvisionlabs/nvidias-new-jetson-xavier-nx-compared-to-jetson-tx2-and-jetson-nano-who-is-the-world-s-smallest-31afd5d9ad63?source=tag_archive---------23-----------------------;https://medium.com/@SeWei?source=tag_archive---------23-----------------------
Dont Get Lost in the Deep;Machine learning is rarely about deep learning. And thats okay.;1;Ravi Malde;Towards Data Science;2020;6;1;deep-learning;6;3;0;https://towardsdatascience.com/dont-get-lost-in-the-deep-26ee0749e04e?source=tag_archive---------24-----------------------;https://towardsdatascience.com/@ravimalde?source=tag_archive---------24-----------------------
Fast Deployment of an Image Classification Web App with fast.ai;NaN;1;Paul Carter;NaN;2020;6;1;deep-learning;11;2;0;https://medium.com/@paul.m.carter1992/fast-deployment-of-an-image-classification-web-app-with-fast-ai-14d0bac48ae7?source=tag_archive---------25-----------------------;https://medium.com/@paul.m.carter1992?source=tag_archive---------25-----------------------
Using deep learning to find Murder Hornets (and protect bees!);By Lisa Harvey;1;MathWorks Editor;MathWorks;2020;6;1;deep-learning;4;1;0;https://medium.com/mathworks/using-deep-learning-to-find-murder-hornets-and-protect-bees-c91e78f5510e?source=tag_archive---------26-----------------------;https://medium.com/@mathworkseditor?source=tag_archive---------26-----------------------
Introduction to RNN and LSTM(Part-1);This article is the beginning of the series on RNN and LSTM and in this one, Ill go through;1;Jeffy sam;Becoming Human: Artificial Intelligence Magazine;2020;6;1;deep-learning;5;101;0;https://becominghuman.ai/introduction-to-rnn-and-lstm-part-1-b6a5934a791c?source=tag_archive---------27-----------------------;https://becominghuman.ai/@jeffysam02?source=tag_archive---------27-----------------------
Understanding Deep Associative Embedding in Convolutional Neural Networks;An elegant method to group;1;Shuchen Du;Towards Data Science;2020;6;1;deep-learning;4;62;0;https://towardsdatascience.com/understanding-deep-associative-embedding-in-convolutional-neural-networks-5a57685ee856?source=tag_archive---------28-----------------------;https://towardsdatascience.com/@dushuchen?source=tag_archive---------28-----------------------
Chunking and Extracting information using NLTKPART -6;NaN;1;Jeffy sam;NaN;2020;6;1;deep-learning;5;0;0;https://medium.com/@jeffysam02/chunking-and-extracting-information-using-nltk-part-6-5ecceeb4aac4?source=tag_archive---------29-----------------------;https://medium.com/@jeffysam02?source=tag_archive---------29-----------------------
MLOPS, Integrating ML with DevOps;NaN;1;Saurabh Agarwal;AI In Plain English;2020;6;1;deep-learning;7;10;0;https://medium.com/ai-in-plain-english/mlops-integrating-ml-with-devops-f340288d3afc?source=tag_archive---------30-----------------------;https://medium.com/@saurabhagarwal43800?source=tag_archive---------30-----------------------
AI-Driven Methods for Detecting and Preventing Online Fraud;NaN;1;ODSC Open Data Science;NaN;2020;6;1;deep-learning;4;5;0;https://medium.com/@ODSC/ai-driven-methods-for-detecting-and-preventing-online-fraud-f70efe1bfdba?source=tag_archive---------31-----------------------;https://medium.com/@ODSC?source=tag_archive---------31-----------------------
Image Classification;In this project, we will use CIFAR-10 dataset, which consist of 10 classes.The dataset stands for the Canadian Institute;1;Amir Boltaev;Noteworthy The Journal Blog;2020;6;1;deep-learning;3;105;0;https://blog.usejournal.com/image-classification-c5da68fbc1bf?source=tag_archive---------32-----------------------;https://blog.usejournal.com/@aboltaev404?source=tag_archive---------32-----------------------
Categorizing Words using NLTKPART-4;In the previous article, we have worked with extracting text from raw and HTML data from the;1;Jeffy sam;The Startup;2020;6;1;deep-learning;5;51;0;https://medium.com/swlh/categorizing-words-using-nltk-part-4-d901c7f224d4?source=tag_archive---------33-----------------------;https://medium.com/@jeffysam02?source=tag_archive---------33-----------------------
Make roads safer with computer vision?;It is neednt to say that unsafe driving causes more trouble for society than almost;1;Yura Vasiliuk;UDrive AI;2020;6;1;deep-learning;5;172;0;https://medium.com/udrive-ai/make-roads-safer-with-computer-vision-69ac1e8a5285?source=tag_archive---------34-----------------------;https://medium.com/@yura.vasiliuk?source=tag_archive---------34-----------------------
 Bert ; Bert;0;Jenny Ching;NaN;2020;6;1;deep-learning;7;2;0;https://medium.com/@tzuruey/%E7%94%A8-bert-%E5%81%9A%E5%85%8B%E6%BC%8F%E5%AD%97%E7%B7%B4%E7%BF%92-27a978184d96?source=tag_archive---------35-----------------------;https://medium.com/@tzuruey?source=tag_archive---------35-----------------------
Investing + Deep Learningan introduction;NaN;1;Predicto;NaN;2020;6;1;deep-learning;5;25;0;https://medium.com/@thepredicto/investing-deep-learning-an-introduction-655badb4720a?source=tag_archive---------36-----------------------;https://medium.com/@thepredicto?source=tag_archive---------36-----------------------
Machine LearningWhy it is an iterative process?;NaN;1;Niwratti Kasture;Analytics Vidhya;2020;6;1;deep-learning;4;26;0;https://medium.com/analytics-vidhya/machine-learning-why-it-is-an-iterative-process-bf709e3b69f2?source=tag_archive---------37-----------------------;https://medium.com/@niwrattikasture?source=tag_archive---------37-----------------------
Construindo uma CNN para qualquer tamanho de imagem;Fala rapaziada. Tudo beleza? Nesse post vamos;1;Guilherme Gaigher Netto;NaN;2020;6;1;deep-learning;4;0;0;https://medium.com/@ggaighernt/construindo-uma-cnn-para-qualquer-tamanho-de-imagem-6070d6009561?source=tag_archive---------38-----------------------;https://medium.com/@ggaighernt?source=tag_archive---------38-----------------------
Deep Dive Density-Based Clustering!;DBSCAN algorithm has been explained in this article with an in-depth explanation of a project!;1;Harshit Dawar;NaN;2020;6;1;deep-learning;6;6;0;https://medium.com/@harshitdawar/deep-dive-density-based-clustering-89edf96fe2d6?source=tag_archive---------39-----------------------;https://medium.com/@harshitdawar?source=tag_archive---------39-----------------------
Making sense of grammar using NLTKPart -7;In our previous article, we focused on the basic information extraction pipeline;1;Jeffy sam;NaN;2020;6;1;deep-learning;4;2;0;https://medium.com/@jeffysam02/making-sense-of-grammar-using-nltk-part-7-81afcccfc5a4?source=tag_archive---------40-----------------------;https://medium.com/@jeffysam02?source=tag_archive---------40-----------------------
My Week in AI: Part 2;Featuring more data engineering with SQL, Wheat Detection Kaggle Competition and research exploring demographic biases;1;Anirudh Shah;Becoming Human: Artificial Intelligence Magazine;2020;6;1;deep-learning;4;53;0;https://becominghuman.ai/my-week-in-ai-part-2-4bc3d61958e5?source=tag_archive---------41-----------------------;https://becominghuman.ai/@anirudhshah?source=tag_archive---------41-----------------------
Introduction to RNN and LSTM(Part-2);In my previous article, we have gone through the basics of a Recurrent Neural Network and also;1;Jeffy sam;NaN;2020;6;1;deep-learning;4;0;0;https://medium.com/@jeffysam02/introduction-to-rnn-and-lstm-part-2-c84c21e3703?source=tag_archive---------42-----------------------;https://medium.com/@jeffysam02?source=tag_archive---------42-----------------------
Introduction to Linear Regression & Train Your First Model.;NaN;1;Ritesh Kumar;NaN;2020;6;1;deep-learning;4;40;0;https://medium.com/@riteshkumar01/introduction-to-linear-regression-train-your-first-model-77d579b7472c?source=tag_archive---------43-----------------------;https://medium.com/@riteshkumar01?source=tag_archive---------43-----------------------
Getting Started with NLTK -Part 1;This article is the beginning of a couple of more blogs on Natural;1;Jeffy sam;NaN;2020;6;1;deep-learning;4;1;0;https://medium.com/@jeffysam02/getting-started-with-nltk-part-1-8c82977488f3?source=tag_archive---------44-----------------------;https://medium.com/@jeffysam02?source=tag_archive---------44-----------------------
Working with Corpus in NLTKPART-2;This article is the continuation of my NLTK series. If you;1;Jeffy sam;NaN;2020;6;1;deep-learning;5;0;0;https://medium.com/@jeffysam02/working-with-corpus-in-nltk-part-2-2afbc5fe1457?source=tag_archive---------45-----------------------;https://medium.com/@jeffysam02?source=tag_archive---------45-----------------------
Radical ReadsJune 1, 2020;Curated deep tech and AI content that humans at Radical are reading and thinking about. Sign up here to have;1;Radical Ventures;NaN;2020;6;1;deep-learning;5;2;0;https://medium.com/@radicalventures/radical-reads-june-1-2020-c1eed54390b2?source=tag_archive---------46-----------------------;https://medium.com/@radicalventures?source=tag_archive---------46-----------------------
Working with raw text using NLTKPART-3;In my previous blog, I have talked about different structured corpora from NLTK module;1;Jeffy sam;NaN;2020;6;1;deep-learning;4;1;0;https://medium.com/@jeffysam02/working-with-raw-text-using-nltk-part-3-3d8cb3e5ecc3?source=tag_archive---------47-----------------------;https://medium.com/@jeffysam02?source=tag_archive---------47-----------------------
An Introduction of the Cutting Edge Technologies- AI, ML, DL (Part-2);NaN;1;alok rawat;NaN;2020;6;1;deep-learning;3;3;0;https://medium.com/@alokrawat050/an-introduction-of-the-cutting-edge-technologies-ai-ml-dl-part-2-7b97c5b52ef3?source=tag_archive---------48-----------------------;https://medium.com/@alokrawat050?source=tag_archive---------48-----------------------
"Faster R-CNN TL;DR";There are many great blogs out there about Faster R-CNN, and the paper itself is not too difficult to read, even for;1;Aviad Moreshet;NaN;2020;6;1;deep-learning;4;0;0;https://medium.com/@aviad10m/faster-r-cnn-tl-dr-7d202c2201d?source=tag_archive---------49-----------------------;https://medium.com/@aviad10m?source=tag_archive---------49-----------------------
Neuromorphic ComputingA Change in the paradigm;NaN;1;Joe Addamo;NaN;2020;6;1;deep-learning;11;7;0;https://medium.com/@jaddamo/neuromorphic-computing-a-change-in-the-paradigm-7b606f6eb52c?source=tag_archive---------50-----------------------;https://medium.com/@jaddamo?source=tag_archive---------50-----------------------
Introduction to RNN and LSTM(Part-5);Good to see you again, in the previous article we finished implementing our RNN to predict the;1;Jeffy sam;NaN;2020;6;1;deep-learning;4;2;0;https://medium.com/@jeffysam02/introduction-to-rnn-and-lstm-part-5-3387eb694699?source=tag_archive---------51-----------------------;https://medium.com/@jeffysam02?source=tag_archive---------51-----------------------
Approximation by Superpositions of a Sigmoidal Function, Math. Control Signals Systems (1989) 2:303314; G. Cybenko  1989 http://www.dartmouth.edu/~gvc/Cybenko_MCSS.pdf;0;Peratham Wiriyathammabhum;NaN;2020;6;1;deep-learning;4;1;0;https://medium.com/@peratham/approximation-by-superpositions-of-a-sigmoidal-function-math-f28a5c5ccb98?source=tag_archive---------52-----------------------;https://medium.com/@peratham?source=tag_archive---------52-----------------------
Extracting features and classifying using NLTKPART-5;NaN;1;Jeffy sam;NaN;2020;6;1;deep-learning;4;0;0;https://medium.com/@jeffysam02/extracting-features-and-classifying-using-nltk-part-5-bd5d4d9b7170?source=tag_archive---------53-----------------------;https://medium.com/@jeffysam02?source=tag_archive---------53-----------------------
More about model calibration;This is an extension of the previous discussion about model;1;Jay Chan;Analytics Vidhya;2020;6;1;deep-learning;5;6;0;https://medium.com/analytics-vidhya/more-about-model-calibration-353dafff9f76?source=tag_archive---------54-----------------------;https://medium.com/@jaychanhoi1991?source=tag_archive---------54-----------------------
5 Practical Ways to Speed Up your Deep Learning Model | Xmartlabs Blog;NaN;1;Xmartlabs;NaN;2020;6;1;deep-learning;9;0;0;https://medium.com/@xmartlabs/5-practical-ways-to-speed-up-your-deep-learning-model-xmartlabs-blog-73f59d9ad7e?source=tag_archive---------55-----------------------;https://medium.com/@xmartlabs?source=tag_archive---------55-----------------------
IMAGE PROCESSING WITH NUMPY;In todays article, I am going to discuss about how we can do image processing with Numpy array. I would like;1;milan bhadja;NaN;2020;6;1;deep-learning;2;0;0;https://medium.com/@milanbhadja7932/image-processing-with-numpy-f94ba62eaf02?source=tag_archive---------56-----------------------;https://medium.com/@milanbhadja7932?source=tag_archive---------56-----------------------
Introduction to RNN and LSTM(Part-3);In our previous article, we started implementing a raw RNN for sequence prediction. We have;1;Jeffy sam;NaN;2020;6;1;deep-learning;3;3;0;https://medium.com/@jeffysam02/introduction-to-rnn-and-lstm-part-3-113772048b0d?source=tag_archive---------57-----------------------;https://medium.com/@jeffysam02?source=tag_archive---------57-----------------------
AI na vida, AI no UX.;Uma abstrao que sempre ignorei, mas que tem sido impossvel mant-la sendo ignorada, em especial no contexto de UX.;1;Mariana Souza;NaN;2020;6;1;deep-learning;11;0;0;https://medium.com/@marianasou.ms/ai-na-vida-ai-no-ux-8bc79d177d63?source=tag_archive---------58-----------------------;https://medium.com/@marianasou.ms?source=tag_archive---------58-----------------------
NaN;Our brains possess a lot of knowledge. We have knowing that awareness (such as knowing that Paris;1;TheodoreTed) Stark;Studio Quick Facts;2020;6;1;deep-learning;3;0;0;https://medium.com/studio-quick-facts/knowing-how-is-all-in-your-head-e216192ca985?source=tag_archive---------59-----------------------;https://medium.com/@theodorestark?source=tag_archive---------59-----------------------
Training a model for Broadway Theater classification;NaN;1;Alexis Hooper;NaN;2020;6;1;deep-learning;4;1;0;https://medium.com/@alexisrhooper/training-a-model-for-broadway-theater-classification-74e4c0464dd?source=tag_archive---------60-----------------------;https://medium.com/@alexisrhooper?source=tag_archive---------60-----------------------
Introduction to RNN and LSTM(Part-4);In my previous article I was done with explaining the forward and backward propagation of our;1;Jeffy sam;NaN;2020;6;1;deep-learning;4;1;0;https://medium.com/@jeffysam02/introduction-to-rnn-and-lstm-part-4-57f6e14530c2?source=tag_archive---------61-----------------------;https://medium.com/@jeffysam02?source=tag_archive---------61-----------------------
NaN;NaN;0;Sai Htaung Kham;NaN;2020;6;1;deep-learning;0;0;1;https://towardsdatascience.com/difference-between-nfd-nfc-nfkd-and-nfkc-explained-with-python-code-e2631f96ae6c?source=tag_archive---------62-----------------------#43ef;https://medium.com/@saihtaungkham?source=tag_archive---------62-----------------------
Transformational and Representation methods in NLP;NaN;1;Jeffy sam;NaN;2020;6;1;deep-learning;4;0;0;https://medium.com/@jeffysam02/transformational-and-representation-methods-in-nlp-1516af723fe?source=tag_archive---------63-----------------------;https://medium.com/@jeffysam02?source=tag_archive---------63-----------------------
Tensors with a Mathematical Touch (or Torch);Week 1 of Zero to GANs Deep Learning with PyTorch course;1;Thenu;NaN;2020;6;1;deep-learning;4;0;0;https://medium.com/@thenu97/tensors-with-a-mathematical-touch-or-torch-4b20376124de?source=tag_archive---------64-----------------------;https://medium.com/@thenu97?source=tag_archive---------64-----------------------
Cara Belajar Yang Efektif Agar Mudah Menguasai Ilmu Apapun;NaN;1;Edward Rhidwan;NaN;2020;6;1;deep-learning;6;0;0;https://medium.com/@therhidwan/cara-belajar-yang-efektif-agar-mudah-menguasai-ilmu-apapun-a55c2e0f987a?source=tag_archive---------65-----------------------;https://medium.com/@therhidwan?source=tag_archive---------65-----------------------
