Title;Subtitle;Image;Author;Publication;Year;Month;Day;Tag;Reading_Time;Claps;Comment;url;Author_urlUsing A.I. to Combat Fake News;Exploring machine learning and NLP uses to automate the process of;1;Michael Harder;Towards Data Science;2020;4;15;Neural Networks;7;56;0;https://towardsdatascience.com/using-a-i-to-combat-fake-news-34f5a51907d6?source=tag_archive---------1-----------------------;https://towardsdatascience.com/@michael_harder?source=tag_archive---------1-----------------------
Creating a Recurrent Neural Network from scratch using C#;NaN;1;Jagath Karra;NaN;2020;4;15;Neural Networks;5;5;0;https://medium.com/@jagathprasad0/creating-a-recurrent-neural-network-from-scratch-using-c-d3543a918925?source=tag_archive---------2-----------------------;https://medium.com/@jagathprasad0?source=tag_archive---------2-----------------------
Deep learning for Python developers (and the average Joe who is just curious about the stuff);NaN;1;Edward Leoni;Learn stuff with Ed;2020;4;15;Neural Networks;18;64;0;https://medium.com/edward-leoni/deep-learning-for-python-developers-and-the-average-joe-who-is-just-curious-about-the-stuff-b971efe54ef4?source=tag_archive---------3-----------------------;https://medium.com/@edwardleoni?source=tag_archive---------3-----------------------
3D Photography using Context-aware Layered Depth Inpainting;NaN;1;Jae Duk Seo;NaN;2020;4;15;Neural Networks;4;10;0;https://medium.com/@SeoJaeDuk/3d-photography-using-context-aware-layered-depth-inpainting-f1a9eec51d74?source=tag_archive---------4-----------------------;https://medium.com/@SeoJaeDuk?source=tag_archive---------4-----------------------
Why Bother Deploying a Huge Neural Model when the Small One is Enough?;Model Compression Techniques;1;Ida Novindasari;Towards Data Science;2020;4;15;Neural Networks;6;51;0;https://towardsdatascience.com/why-bother-deploying-a-huge-neural-model-when-the-small-one-is-enough-47b9a2da8df1?source=tag_archive---------5-----------------------;https://towardsdatascience.com/@idanovinda?source=tag_archive---------5-----------------------
D4S Sunday Briefing #46;A weekly newsletter with the latest developments in Data Science and Machine;1;Bruno Gon alves;Data For Science;2020;4;15;Neural Networks;4;2;0;https://medium.com/data-for-science/d4s-sunday-briefing-46-92f05fb37fad?source=tag_archive---------6-----------------------;https://medium.com/@bgoncalves?source=tag_archive---------6-----------------------
ML Paper Challenge Day 3 , 4 A Fast Learning Algorithm for Deep Belief Nets;NaN;1;Chun-kit Ho;NaN;2020;4;15;Neural Networks;4;0;0;https://medium.com/@ckho/ml-paper-challenge-day-3-4-a-fast-learning-algorithm-for-deep-belief-nets-79707cebf1a?source=tag_archive---------7-----------------------;https://medium.com/@ckho?source=tag_archive---------7-----------------------
Artificial Intelligence 101;At this moment when everyone is so thrilled with the idea of Artificial Intelligence, I wanted to write about;1;Harsh Rathod;NaN;2020;4;15;Neural Networks;7;3;0;https://medium.com/@thecreator/artificial-intelligence-101-e9f2c016257?source=tag_archive---------8-----------------------;https://medium.com/@thecreator?source=tag_archive---------8-----------------------
Simplistic way to understand Neural Networks learning step by step from initialisation to;NaN;1;afb labs;NaN;2020;4;15;Neural Networks;3;9;0;https://medium.com/@afblabs7/simplistic-way-to-understand-neural-networks-learning-step-by-step-from-initialisation-to-2f1c9286767b?source=tag_archive---------9-----------------------;https://medium.com/@afblabs7?source=tag_archive---------9-----------------------
What are the some of the over hyped terms and what do they mean?;Artificial Intelligence, Machine;1;Chan Naseeb;Data-and-AI;2020;4;15;Neural Networks;1;0;0;https://medium.com/data-and-ai/what-are-the-some-of-the-over-hyped-terms-and-what-do-they-mean-c164135a2aa8?source=tag_archive---------10-----------------------;https://medium.com/@channaseeb?source=tag_archive---------10-----------------------
How to Create a Custom Loss Function | Keras;For Neural Nets;1;Shiva Verma;Towards Data Science;2020;4;16;Neural Networks;3;261;0;https://towardsdatascience.com/how-to-create-a-custom-loss-function-keras-3a89156ec69b?source=tag_archive---------0-----------------------;https://towardsdatascience.com/@shiva-verma?source=tag_archive---------0-----------------------
Understanding neural networks 2: The math of neural networks in 3 equations;NaN;1;Aleksander Obuchowski;Becoming Human: Artificial Intelligence Magazine;2020;4;16;Neural Networks;10;260;0;https://becominghuman.ai/understanding-neural-networks-2-the-math-of-neural-networks-in-3-equations-6085fd3f09df?source=tag_archive---------1-----------------------;https://becominghuman.ai/@aleksanderobuchowski?source=tag_archive---------1-----------------------
Work smarter, not harder when building neural networks;A fundamental technique in applied mathematics;1;Kevin Hannay;Towards Data Science;2020;4;16;Neural Networks;8;369;0;https://towardsdatascience.com/work-smarter-not-harder-when-building-neural-networks-6f4aa7c5ee61?source=tag_archive---------2-----------------------;https://towardsdatascience.com/@moleculeboy24?source=tag_archive---------2-----------------------
Como escolher o nmero de neurnios na camada oculta de uma Rede Neural?;Exemplo prtico de como;1;Nath lia Tito;NaN;2020;4;16;Neural Networks;9;26;0;https://medium.com/@nathaliatito/como-escolher-o-n%C3%BAmero-de-neur%C3%B4nios-na-camada-oculta-da-sua-rede-neural-93d591cb838d?source=tag_archive---------3-----------------------;https://medium.com/@nathaliatito?source=tag_archive---------3-----------------------
Teachable Machines With Google;Hello Folks, Thanks for appreciating and liking my first blog of Auto ML. After good response of my that;1;PIYUSH PATHAK;Analytics Vidhya;2020;4;16;Neural Networks;5;12;0;https://medium.com/analytics-vidhya/teachable-machine-with-google-baaed5104d08?source=tag_archive---------4-----------------------;https://medium.com/@piyushpathak03?source=tag_archive---------4-----------------------
Using neural networks to track irregular heartbeats;Building a Pytorch model to detect Atrial;1;Pedro Silva;1D.works;2020;4;16;Neural Networks;7;33;0;https://medium.com/1d-works/using-neural-networks-to-track-irregular-heartbeats-e044192ba463?source=tag_archive---------5-----------------------;https://medium.com/@pedrobnsilva?source=tag_archive---------5-----------------------
Evaluating the Accuracy of My Video Search Engine;I trained a ResNet-50 model to find a ping pong ball;1;Rodrigo Fuentes;Towards Data Science;2020;4;16;Neural Networks;11;47;0;https://towardsdatascience.com/evaluating-the-accuracy-of-my-video-search-engine-1235f375bd5?source=tag_archive---------6-----------------------;https://towardsdatascience.com/@rodrigofuentes7?source=tag_archive---------6-----------------------
How to Implement a Neural Network with only +1 and -1 ?;NaN;1; a r  Aydo du;Analytics Vidhya;2020;4;16;Neural Networks;4;42;0;https://medium.com/analytics-vidhya/how-to-implement-a-neural-network-with-only-1-and-1-5170e80fd65?source=tag_archive---------7-----------------------;https://medium.com/@cagriaydogdu2334?source=tag_archive---------7-----------------------
From data preparation to parameter tuning using Tensorflow for training with RNNs;NaN;1;Padmaja Kulkarni;Analytics Vidhya;2020;4;16;Neural Networks;4;50;0;https://medium.com/analytics-vidhya/from-data-preparation-to-parameter-tuning-using-tensorflow-for-training-with-rnns-24610783aeb1?source=tag_archive---------8-----------------------;https://medium.com/@padmaja.hbrs?source=tag_archive---------8-----------------------
Artificial Neural Networks;Over-Simplified for beginners;1;Madhawa Bandara;Data Driven Investor;2020;4;16;Neural Networks;11;300;0;https://medium.com/datadriveninvestor/artificial-neural-networks-over-simplified-7ed8d8b7d3fc?source=tag_archive---------9-----------------------;https://medium.com/@madhawa.uop?source=tag_archive---------9-----------------------
"Olportal; The first decentralized messenger on hybrid neural networks";NaN;1;MrIncredible;NaN;2020;4;16;Neural Networks;5;0;0;https://medium.com/@ogbeniiyalenu/olportal-the-first-decentralized-messenger-on-hybrid-neural-networks-9c54bb412a35?source=tag_archive---------10-----------------------;https://medium.com/@ogbeniiyalenu?source=tag_archive---------10-----------------------
ML Paper Challenge Day 5Reducing the Dimensionality of Data with Neural Networks;NaN;1;Chun-kit Ho;NaN;2020;4;16;Neural Networks;2;0;0;https://medium.com/@ckho/ml-paper-challenge-day-5-reducing-the-dimensionality-of-data-with-neural-networks-6de42871a106?source=tag_archive---------11-----------------------;https://medium.com/@ckho?source=tag_archive---------11-----------------------
Shedding Light On Artificial Intelligence vs Machine Learning vs Deep LearningV2Solutions;NaN;1;V2Solutions Inc.;NaN;2020;4;16;Neural Networks;5;0;0;https://medium.com/@v2solutions/shedding-light-on-artificial-intelligence-vs-machine-learning-vs-deep-learning-v2solutions-5e8894e252e4?source=tag_archive---------12-----------------------;https://medium.com/@v2solutions?source=tag_archive---------12-----------------------
Creating Deep Neural Networks from Scratch, an Introduction to Reinforcement Learning;NaN;1;Abhav Kedia;Towards Data Science;2020;4;17;Neural Networks;13;33;0;https://towardsdatascience.com/creating-deep-neural-networks-from-scratch-an-introduction-to-reinforcement-learning-6bba874019db?source=tag_archive---------0-----------------------;https://towardsdatascience.com/@abhavkedia?source=tag_archive---------0-----------------------
OSAI empowered Russian Table Tennis Championship with CV and AI analytics;NaN;1;OSAI;NaN;2020;4;17;Neural Networks;4;981;0;https://medium.com/@osai.ai/osai-empowered-russian-table-tennis-championship-with-cv-and-ai-analytics-e7d52a6d8a5c?source=tag_archive---------1-----------------------;https://medium.com/@osai.ai?source=tag_archive---------1-----------------------
Inteligencia Artificial y sus aplicaciones;El potencial de la IA se remonta a los aos 70 y estas son;1;Walacy Campos;Planeta Chatbot todo sobre los Chat bots, Voice apps e Inteligencia Artificial;2020;4;17;Neural Networks;11;1;0;https://planetachatbot.com/inteligencia-artificial-y-aplicaciones-13ace66f4e7e?source=tag_archive---------2-----------------------;https://planetachatbot.com/@camposwalacy?source=tag_archive---------2-----------------------
Creating a Neural Network from Scratch Using PyTorch;NaN;1;Lankinen;AI In Plain English;2020;4;17;Neural Networks;2;7;0;https://medium.com/ai-in-plain-english/neural-network-from-scratch-using-pytorch-448cee36f268?source=tag_archive---------3-----------------------;https://medium.com/@lankinen?source=tag_archive---------3-----------------------
Creating a Neural Network from Scratch Using Tensorflow;NaN;1;Lankinen;AI In Plain English;2020;4;17;Neural Networks;2;4;0;https://medium.com/ai-in-plain-english/neural-network-from-scratch-using-tensorflow-9d47f37e77a1?source=tag_archive---------4-----------------------;https://medium.com/@lankinen?source=tag_archive---------4-----------------------
Implementation of Neural Style Transfer using Deep Learning;NaN;1;Oodles AI;NaN;2020;4;17;Neural Networks;2;0;0;https://medium.com/@Oodles_ai/implementation-of-neural-style-transfer-using-deep-learning-dba7c4ba3dcb?source=tag_archive---------5-----------------------;https://medium.com/@Oodles_ai?source=tag_archive---------5-----------------------
Self Driving Car Using Deep Learning;The idea behind this project was to train an end-to-end deep learning model that would let a;1;Safwen Naimi;Self Driving Car Using Deep Learning;2020;4;17;Neural Networks;3;0;0;https://medium.com/self-driving-car-using-deep-learning/self-driving-car-using-deep-learning-3439a9cf5214?source=tag_archive---------6-----------------------;https://medium.com/@safwen.naimi?source=tag_archive---------6-----------------------
Understanding Backpropagation(Gradient Descent) in Neural Networks for Binary Classification;NaN;1;afb labs;NaN;2020;4;17;Neural Networks;5;12;0;https://medium.com/@afblabs7/understanding-backpropagation-gradient-descent-in-neural-networks-for-binary-classification-d5305f0765e8?source=tag_archive---------7-----------------------;https://medium.com/@afblabs7?source=tag_archive---------7-----------------------
Data Sciencewhat is this magic?;NaN;1;Dabbling Data Scientist;NaN;2020;4;17;Neural Networks;3;0;0;https://medium.com/@dabblingdatascientist/data-science-what-is-this-magic-b2aa5eaf2a15?source=tag_archive---------8-----------------------;https://medium.com/@dabblingdatascientist?source=tag_archive---------8-----------------------
ML Paper Challenge Day 6ImageNet Classification with Deep Convolutional Neural Networks;NaN;1;Chun-kit Ho;NaN;2020;4;17;Neural Networks;3;0;0;https://medium.com/@ckho/ml-paper-challenge-day-6-imagenet-classification-with-deep-convolutional-neural-networks-532b8329dacd?source=tag_archive---------9-----------------------;https://medium.com/@ckho?source=tag_archive---------9-----------------------
New research projects for Artificial Intelligence guidelines;NaN;1;Raffaella Aghemo;AI In Plain English;2020;4;17;Neural Networks;4;0;0;https://medium.com/ai-in-plain-english/new-research-projects-for-artificial-intelligence-guidelines-353eccfaa9d2?source=tag_archive---------10-----------------------;https://medium.com/@raffa-aghemo?source=tag_archive---------10-----------------------
Neural Network + Genetic Algorithm + Game = ;This is how I created an A.I. that beat this game;1;Sujan Dutta;Towards Data Science;2020;4;18;Neural Networks;5;143;0;https://towardsdatascience.com/neural-network-genetic-algorithm-game-15320b3a44e3?source=tag_archive---------0-----------------------;https://towardsdatascience.com/@sujan99dutta?source=tag_archive---------0-----------------------
Match Prediction in League of Legends Using Vanilla Deep Neural Network;Learn about the League of;1;Seouk Jun Kim;Towards Data Science;2020;4;18;Neural Networks;9;71;0;https://towardsdatascience.com/match-prediction-in-league-of-legends-using-vanilla-deep-neural-network-7cadc6fce7dd?source=tag_archive---------1-----------------------;https://towardsdatascience.com/@kdanielive?source=tag_archive---------1-----------------------
Preprocess and prepare a face dataset ready for CNN models;Lets extract faces from IMDB-WIKI dataset;1;Nachi Muthu;Towards Data Science;2020;4;18;Neural Networks;9;40;0;https://towardsdatascience.com/preprocess-and-prepare-a-face-dataset-ready-for-cnn-models-885867907eb0?source=tag_archive---------2-----------------------;https://towardsdatascience.com/@nachi2muthu13?source=tag_archive---------2-----------------------
Introduction to ANN AlgorithmsICU Prediction Model in Python;Understand how fully connected;1;Sydney Chen;Python In Plain English;2020;4;18;Neural Networks;7;105;0;https://medium.com/python-in-plain-english/introduction-of-ann-algorithm-icu-classification-model-in-python-b4ddbdb6db6a?source=tag_archive---------3-----------------------;https://medium.com/@sydneychen222?source=tag_archive---------3-----------------------
ADADELTA: An Adoptive learning rate method;The aim of many machine learning methods is to update a set;1;Sourav Dash;NaN;2020;4;18;Neural Networks;4;1;0;https://medium.com/@srv96/adadelta-an-adoptive-learning-rate-method-108534e6be3f?source=tag_archive---------4-----------------------;https://medium.com/@srv96?source=tag_archive---------4-----------------------
Traffic Sign Recognition Problem with GTSRB, Python and Keras;NaN;1;Ivan S Rusanov;AI In Plain English;2020;4;18;Neural Networks;3;0;0;https://medium.com/ai-in-plain-english/traffic-sign-recognition-problem-with-gtsrb-python-and-keras-21782b7b3520?source=tag_archive---------5-----------------------;https://medium.com/@ivan.s.rusanov?source=tag_archive---------5-----------------------
Solving Overfitting in Neural Nets With Regularization;NaN;1;Rishit Dagli;Towards Data Science;2020;4;18;Neural Networks;10;207;0;https://towardsdatascience.com/solving-overfitting-in-neural-nets-with-regularization-301c31a7735f?source=tag_archive---------6-----------------------;https://towardsdatascience.com/@rishit.dagli?source=tag_archive---------6-----------------------
The Neural Network A-Z List;The Neural Network A-Z List;0;Barak Or;NaN;2020;4;18;Neural Networks;1;32;0;https://medium.com/@barakor/the-neural-network-a-z-list-f2c51697b8b0?source=tag_archive---------7-----------------------;https://medium.com/@barakor?source=tag_archive---------7-----------------------
Build an Image Classifier using Deep Neural Network and Keras;Image classification using Deep Neural;1;Sourav Bhattacharyya;AI In Plain English;2020;4;18;Neural Networks;6;57;0;https://medium.com/ai-in-plain-english/digit-mnist-image-classification-using-deep-neural-network-and-keras-ae1d4533db8a?source=tag_archive---------8-----------------------;https://medium.com/@sourav_srv_bhattacharyya?source=tag_archive---------8-----------------------
Best Resources to learn AI & Deep Learning;Over the last few years, Deep Learning has proven itself to be the game-changer. This;1;Jagath Karra;NaN;2020;4;18;Neural Networks;3;3;0;https://medium.com/@jagathprasad0/best-resources-to-learn-ai-deep-learning-c4c330b58f33?source=tag_archive---------9-----------------------;https://medium.com/@jagathprasad0?source=tag_archive---------9-----------------------
Contemporary Approach to Localize Sound Source in Visual Scenes;Summary of Learning to Localize Sound Source in;1;Milbir Guram;NaN;2020;4;18;Neural Networks;8;1.2K;0;https://medium.com/@milbir97/contemporary-approach-to-localize-sound-source-in-visual-scenes-9f3299464912?source=tag_archive---------10-----------------------;https://medium.com/@milbir97?source=tag_archive---------10-----------------------
Vision-and-Language Navigation: Interpreting visually-grounded navigation instructions in real environments;NaN;1;Jae Duk Seo;NaN;2020;4;18;Neural Networks;4;0;0;https://medium.com/@SeoJaeDuk/vision-and-language-navigation-interpreting-visually-grounded-navigation-instructions-in-real-8e2fa6dc408e?source=tag_archive---------11-----------------------;https://medium.com/@SeoJaeDuk?source=tag_archive---------11-----------------------
Predict the re-sale price of BMW car using Neural Network;NaN;1;SUMEET SAWANT;NaN;2020;4;18;Neural Networks;4;0;0;https://medium.com/@sumsaw7/predict-the-re-sale-price-of-bmw-car-using-neural-network-21f379d99e11?source=tag_archive---------12-----------------------;https://medium.com/@sumsaw7?source=tag_archive---------12-----------------------
Neural Science | The Brain and Behavior | 1;NaN;0;Payal;NaN;2020;4;18;Neural Networks;4;50;0;https://medium.com/@quepayal/neural-science-the-brain-and-behavior-1-807752ad1288?source=tag_archive---------13-----------------------;https://medium.com/@quepayal?source=tag_archive---------13-----------------------
NaN;NaN;0;Chun-kit Ho;NaN;2020;4;18;Neural Networks;1;1;0;https://medium.com/@ckho/ml-paper-challenge-day-7-very-deep-convolutional-networks-for-large-scale-image-recognition-7fb87564eec0?source=tag_archive---------14-----------------------;https://medium.com/@ckho?source=tag_archive---------14-----------------------
Smart Voice Assistant. Her becoming a reality!;NaN;1;Meher Dinesh Naroju;NaN;2020;4;18;Neural Networks;2;0;0;https://medium.com/@meherdinesh.naroju/smart-voice-assistant-her-becoming-a-reality-224a5bb8f4a3?source=tag_archive---------15-----------------------;https://medium.com/@meherdinesh.naroju?source=tag_archive---------15-----------------------
Losses explained: Contrastive Loss;This is a series of posts explaining different loss functions used for the task of Face;1;Maksym Bekuzarov;NaN;2020;4;19;Neural Networks;11;76;0;https://medium.com/@maksym.bekuzarov/losses-explained-contrastive-loss-f8f57fe32246?source=tag_archive---------0-----------------------;https://medium.com/@maksym.bekuzarov?source=tag_archive---------0-----------------------
Backpropagation from scratch on Mini-Batches;Implementation of Backpropagation algo on mini-batches;1;Aayush Bajaj;Towards Data Science;2020;4;19;Neural Networks;5;29;0;https://towardsdatascience.com/backpropagation-from-scratch-on-mini-batches-e6efdaa281a2?source=tag_archive---------1-----------------------;https://towardsdatascience.com/@theAayushbajaj?source=tag_archive---------1-----------------------
Deep Learning Made Easy: Part 1: Introduction to Neural Networks;The only prerequisite for this;1;Sachin Kumar;Towards Data Science;2020;4;19;Neural Networks;5;120;0;https://towardsdatascience.com/deep-learning-made-easy-part-1-introduction-to-neural-networks-434df17d8f03?source=tag_archive---------2-----------------------;https://towardsdatascience.com/@sachinkumar_59021?source=tag_archive---------2-----------------------
Deep Learning OptimizersHard? Not.;Deep Learning is the one of the most advancing technologies;1;Hmrishav Bandyopadhyay;Towards Data Science;2020;4;19;Neural Networks;5;8;0;https://towardsdatascience.com/deep-learning-optimizers-hard-not-3f5c4f7b4e96?source=tag_archive---------3-----------------------;https://towardsdatascience.com/@hmrishavbandyopadhyay?source=tag_archive---------3-----------------------
Image Classification using Tensorflow2.0 on CIFAR-10 dataset;NaN;1;Namratesh Shrivastav;Analytics Vidhya;2020;4;19;Neural Networks;5;3;0;https://medium.com/analytics-vidhya/image-classification-using-tensorflow2-0-with-cifar-10-dataset-cc595ceb0082?source=tag_archive---------4-----------------------;https://medium.com/@namratesh?source=tag_archive---------4-----------------------
Predicting COVID-19 cases with Neural Networks using PyTorch;NaN;1; lvaro MR;NaN;2020;4;19;Neural Networks;20;21;0;https://medium.com/@alvmarrod/predicting-covid-19-cases-with-neural-networks-using-pytorch-454780a3a773?source=tag_archive---------5-----------------------;https://medium.com/@alvmarrod?source=tag_archive---------5-----------------------
The Overlooked Side of Neural ODEs;Neural ODEs of the 18th century can significantly improve their;1;Ramin Hasani;Analytics Vidhya;2020;4;19;Neural Networks;7;119;0;https://medium.com/analytics-vidhya/the-overlooked-side-of-neural-odes-ab90a5dbdc2a?source=tag_archive---------6-----------------------;https://medium.com/@raminhasani?source=tag_archive---------6-----------------------
Computer Vision SeriesMathematics behind ANN(Chapter-1);NaN;1;Dhamo Dharan;sniper.ai;2020;4;19;Neural Networks;7;58;0;https://medium.com/sniper-ai/computer-vision-series-mathematics-behind-ann-chapter-1-1ffaec8ea9a5?source=tag_archive---------7-----------------------;https://medium.com/@dhamodharangaiml?source=tag_archive---------7-----------------------
NaN;Neural Network with Apache Spark Machine Learning Multilayer Perceptron Classifier;1;jentek llc;NaN;2020;4;19;Neural Networks;12;0;0;https://medium.com/@jentekllc8888/neural-network-with-apache-spark-machine-learning-multilayer-perceptron-classifier-704d2f51c33f?source=tag_archive---------8-----------------------;https://medium.com/@jentekllc8888?source=tag_archive---------8-----------------------
An Approach for Computer Vision Indoor Scene Understanding in 2.5D (RGB-D) and 3D;NaN;1;Varun Bhaseen;NaN;2020;4;19;Neural Networks;14;4;0;https://medium.com/@varun-bhaseen/an-approach-for-computer-vision-indoor-scene-understanding-in-2-5rgb-d-and-3d-b77a133574a0?source=tag_archive---------9-----------------------;https://medium.com/@varun-bhaseen?source=tag_archive---------9-----------------------
Identifying COVID-19 induced Pneumonia With AI;Using Keras VGG16 with Transfer Learning to Detect;1;Ariel Liu;Data Driven Investor;2020;4;19;Neural Networks;7;330;0;https://medium.com/datadriveninvestor/identifying-covid-19-induced-pneumonia-with-ai-5ae7fb5ee97b?source=tag_archive---------10-----------------------;https://medium.com/@ariel-yc-liu?source=tag_archive---------10-----------------------
Graph-based Deep Learning: Approaching a True Neural Network;friends, molecules and brains arent so;1;Mark Cleverley;NaN;2020;4;19;Neural Networks;5;1;0;https://medium.com/@mark-s-cleverley/graph-based-deep-learning-approaching-a-true-neural-network-e2a95a3a1efc?source=tag_archive---------11-----------------------;https://medium.com/@mark-s-cleverley?source=tag_archive---------11-----------------------
What does Jennifer Aniston neuron tell us about the Brain-Machine Interface?;NaN;1;Lucas Galdino;NaN;2020;4;19;Neural Networks;5;22;0;https://medium.com/@GaldinoLabs/what-does-jennifer-aniston-neuron-tell-us-about-the-brain-machine-interface-8aa78d4f0173?source=tag_archive---------12-----------------------;https://medium.com/@GaldinoLabs?source=tag_archive---------12-----------------------
A Simple Neural Networks for Binary Classification -Understanding Feed Forward;NaN;1;Anupam Kumar;Data Science;2020;4;19;Neural Networks;4;63;0;https://medium.com/afblabs-data-science/a-simple-neural-networks-for-binary-classification-understanding-feed-forward-68c3c0659f78?source=tag_archive---------13-----------------------;https://medium.com/@anupam3693?source=tag_archive---------13-----------------------
A Simple Neural Networks for Binary Classification -Understanding Backpropogation (Gradient Descent);NaN;1;Anupam Kumar;Data Science;2020;4;19;Neural Networks;5;71;0;https://medium.com/afblabs-data-science/a-simple-neural-networks-for-binary-classification-understanding-backpropogation-gradient-5aa26914f0c0?source=tag_archive---------14-----------------------;https://medium.com/@anupam3693?source=tag_archive---------14-----------------------
