Title;Subtitle;Image;Author;Publication;Year;Month;Day;Tag;Reading_Time;Claps;Comment;url;Author_urlMaking Your Organisation Data-Driven [MYOD];NaN;1;Kshira Saagar;NaN;2020;7;7;data;6;0;0;https://medium.com/@kshira_saagar/making-your-organisation-data-driven-myod-573db37c48c5?source=tag_archive---------24-----------------------;https://medium.com/@kshira_saagar?source=tag_archive---------24-----------------------
Construir una biografa virtual: Conservando archivos digitales personales;NaN;1;Jos  Pablo Morales;NaN;2020;7;7;data;5;0;0;https://medium.com/@jpmoralesv98/construir-una-biograf%C3%ADa-virtual-conservando-archivos-digitales-personales-19c5b537e0eb?source=tag_archive---------25-----------------------;https://medium.com/@jpmoralesv98?source=tag_archive---------25-----------------------
Heres how you start fixing a data discrepancy.;NaN;1;Jolyn Cheo;NaN;2020;7;7;data;3;0;0;https://medium.com/@jolyncheo/heres-how-you-start-fixing-a-data-discrepancy-94bca046f098?source=tag_archive---------26-----------------------;https://medium.com/@jolyncheo?source=tag_archive---------26-----------------------
When WIFI and the GPS do not work, let sound carry your data;NaN;1;Sonarax Technologies;Sonarax Technologies;2020;7;7;data;6;0;0;https://medium.com/sonarax-technologies/when-wifi-and-the-gps-do-not-work-let-sound-carry-your-data-b9c0920be9c8?source=tag_archive---------27-----------------------;https://medium.com/@Sonarax?source=tag_archive---------27-----------------------
Your Data-Driven SME;Every action within our business results in some data that can help us make;1;Matt Reynolds@mbrit);NaN;2020;7;7;data;4;1;0;https://medium.com/@mbrit/your-data-driven-sme-2b3c4f32751f?source=tag_archive---------28-----------------------;https://medium.com/@mbrit?source=tag_archive---------28-----------------------
Data Driven Project ManagementSeries 1;In the current Digital Era, taking informed decisions helps the Project Managers (PMs). Almost most of the projects have sufficient data that PMs can leverage to take an informed decision.;0;Raja Kumar;NaN;2020;7;7;data;2;0;0;https://medium.com/@rajaws1977/data-driven-project-management-series-1-ce230f8068ad?source=tag_archive---------29-----------------------;https://medium.com/@rajaws1977?source=tag_archive---------29-----------------------
Say goodbye to mundane tasks in the data centre;By W. Curtis Preston, Chief Technical Evangelist, Druva;1;Digital Bulletin;Digital Bulletin;2020;7;7;data;4;0;0;https://medium.com/digital-bulletin/say-goodbye-to-mundane-tasks-in-the-data-centre-8ecf87e25fbd?source=tag_archive---------30-----------------------;https://medium.com/@DigitalBulletin?source=tag_archive---------30-----------------------
Is BI your Steering Wheel or Spare Wheel?;It is high time to ask this one question to yourself and your team of decision-makers;1;Benazir Khan;NaN;2020;7;7;data;4;0;0;https://medium.com/@amtexbi/is-bi-your-steering-wheel-or-spare-wheel-1f94363eec99?source=tag_archive---------31-----------------------;https://medium.com/@amtexbi?source=tag_archive---------31-----------------------
Data is Cheating, especially Index;I realized Data is cheating when I was analyzing the stock;1;Pete Cai;NaN;2020;7;7;data;2;12;0;https://medium.com/@cai-pete-sh/data-is-cheating-especially-index-f2ca3178c732?source=tag_archive---------32-----------------------;https://medium.com/@cai-pete-sh?source=tag_archive---------32-----------------------
NaN;NaN;0;kim lucas;NaN;2020;7;7;data;0;0;0;https://medium.com/@lkim753951/my-first-data-mining-project-c69085ebe0af?source=tag_archive---------33-----------------------;https://medium.com/@lkim753951?source=tag_archive---------33-----------------------
The Remote Office: IT Implications Of The New World of Work;NaN;1;CloverDX;NaN;2020;7;7;data;4;0;0;https://medium.com/@CloverDX/the-remote-office-it-implications-of-the-new-world-of-work-4f4871551223?source=tag_archive---------34-----------------------;https://medium.com/@CloverDX?source=tag_archive---------34-----------------------
The Data Series: Part III (Final);How data collection and presentation is linked to performance.;1;B;NaN;2020;7;7;data;6;0;0;https://medium.com/@bkwrites/the-data-series-part-iii-final-e6bdf56b5e42?source=tag_archive---------35-----------------------;https://medium.com/@bkwrites?source=tag_archive---------35-----------------------
Centralizing eCommerce data;Centralizing eCommerce data is currently the most efficient approach to database management. These days;1;DigiCommerce;NaN;2020;7;7;data;2;0;0;https://medium.com/@digicommercegroup/centralizing-ecommerce-data-6ee2ba817080?source=tag_archive---------36-----------------------;https://medium.com/@digicommercegroup?source=tag_archive---------36-----------------------
What Managed EDR Can Do for Your Data Security That Anti-Virus Cannot;NaN;1;Aroon Duncanson;3nomit;2020;7;7;data;3;0;0;https://medium.com/3nomit/what-managed-edr-can-do-for-your-data-security-that-anti-virus-cannot-c9b8ccf2289d?source=tag_archive---------37-----------------------;https://medium.com/@aroonduncanson?source=tag_archive---------37-----------------------
Byte Down: Making Netflixs Data Infrastructure Cost-Effective;NaN;1;Netflix Technology Blog;Netflix TechBlog;2020;7;8;data;8;1.1K;0;https://netflixtechblog.com/byte-down-making-netflixs-data-infrastructure-cost-effective-fee7b3235032?source=tag_archive---------0-----------------------;https://netflixtechblog.com/@netflixtechblog?source=tag_archive---------0-----------------------
How to Interpret and Calculate X Times More Likely Statistics;NaN;1;Lisa Chen;Towards Data Science;2020;7;8;data;6;61;0;https://towardsdatascience.com/how-to-interpret-and-calculate-x-times-more-likely-statistics-daf538a9e0f4?source=tag_archive---------1-----------------------;https://towardsdatascience.com/@lisachen_7431?source=tag_archive---------1-----------------------
Scrape Structured Data with Python and Extruct;Supercharge your scraper to extract quality page;1;Todd Birchard;Hackers and Slackers;2020;7;8;data;11;32;0;https://hackingandslacking.com/scrape-structured-data-with-python-and-extruct-ee1305493307?source=tag_archive---------2-----------------------;https://hackingandslacking.com/@toddbirchard.?source=tag_archive---------2-----------------------
Cloud Spanner Change Watcher;Spanner Change Watcher is a Java library that can trigger events based on;1;Knut Olav L ite;Google Cloud Community;2020;7;8;data;6;73;0;https://medium.com/google-cloud/cloud-spanner-change-watcher-b77ca036459c?source=tag_archive---------3-----------------------;https://medium.com/@knutolavloite?source=tag_archive---------3-----------------------
Preprocessing Data: Feature Scaling;Some of the important Feature Scaling techniques with sklearn;1;Kamal Chouhbi;Towards Data Science;2020;7;8;data;5;36;0;https://towardsdatascience.com/preprocessing-data-feature-scaling-cc28c508e8af?source=tag_archive---------4-----------------------;https://towardsdatascience.com/@chouhbik?source=tag_archive---------4-----------------------
Friend of the Lab: Andrew Eland;Claire Fram sat down with Andrew Eland to talk about data, the built environment, and trying to build;1;Claire Fram;Arup s City Modelling Lab;2020;7;8;data;8;32;0;https://medium.com/arupcitymodelling/friend-of-the-lab-andrew-eland-83a7d1e76da4?source=tag_archive---------5-----------------------;https://medium.com/@fram_claire?source=tag_archive---------5-----------------------
NaN;Mining BitTorrent networks;1;Deepak Karunakaran;Towards Data Science;2020;7;8;data;8;62;0;https://towardsdatascience.com/towards-torrent-science-data-engineering-d79e774886cb?source=tag_archive---------6-----------------------;https://towardsdatascience.com/@dyaus?source=tag_archive---------6-----------------------
Differential Privacy: Embedding Privacy Into Data Usage;Privacy violation cases are soaring and call;1;Capgemini Invent;The Startup;2020;7;8;data;10;70;0;https://medium.com/swlh/differential-privacy-embedding-privacy-into-data-usage-f827f620f886?source=tag_archive---------7-----------------------;https://medium.com/@capgemini-invent-europe?source=tag_archive---------7-----------------------
Counting the Dead: What is COVIDs True Effect on Africa?;NaN;1;Cooper/Smith;Cooper/Smith;2020;7;8;data;7;5;0;https://medium.com/cooper-smith/counting-the-dead-what-is-covids-true-effect-on-africa-7f9a08a05c4?source=tag_archive---------8-----------------------;https://medium.com/@CooperSmithOrg?source=tag_archive---------8-----------------------
Local Insights for Global Action;Reflections from Open Data Meetup for COVID-19 in New Zealand;1;Open Data Charter;NaN;2020;7;8;data;5;16;0;https://medium.com/@opendatacharter/local-insights-for-global-action-9d7c3be37d69?source=tag_archive---------9-----------------------;https://medium.com/@opendatacharter?source=tag_archive---------9-----------------------
Cloud Spanner Change Publisher;Spanner Change Publisher is an application that can publish data change;1;Knut Olav L ite;Google Cloud Community;2020;7;8;data;6;96;0;https://medium.com/google-cloud/cloud-spanner-change-publisher-7fbee48f66f8?source=tag_archive---------10-----------------------;https://medium.com/@knutolavloite?source=tag_archive---------10-----------------------
Paycheck Protection Program (PPP Loans)Where did they go?;This is an analysis of that data with a;1;Colton Shaw;NaN;2020;7;8;data;4;0;0;https://medium.com/@coltoneshaw/paycheck-protection-program-where-did-it-go-ed2067441102?source=tag_archive---------11-----------------------;https://medium.com/@coltoneshaw?source=tag_archive---------11-----------------------
Sustaining Progress on Economic Mobility During COVID-19;Lessons learned from the recent WWC Economic;1;What Works Cities;What Works Cities Economic Mobility Initiative;2020;7;8;data;7;5;0;https://medium.com/what-works-cities-economic-mobility-initiative/sustaining-progress-on-economic-mobility-during-covid-19-b7b203710737?source=tag_archive---------12-----------------------;https://medium.com/@whatworkscities?source=tag_archive---------12-----------------------
Ease Fears Over Data Sharing Online with Zero-Party Data;Give consumers control over what they share;1;havas CX helia;NaN;2020;7;8;data;4;6;0;https://medium.com/@havascxhelia/ease-fears-over-data-sharing-online-with-zero-party-data-ec2474b04a74?source=tag_archive---------13-----------------------;https://medium.com/@havascxhelia?source=tag_archive---------13-----------------------
Where to keep my Contact Data? CRM or Marketing Automation;This is a controversial topic discussed, when companies start using the tech tools viz., CRM, and Marketing Automation.;0;Dr. Shiv;NaN;2020;7;8;data;3;2;0;https://medium.com/@dr-shiv/where-to-keep-my-contact-data-crm-or-marketing-automation-c2e0470b3494?source=tag_archive---------14-----------------------;https://medium.com/@dr-shiv?source=tag_archive---------14-----------------------
Non-Programmer Welcome- Sum, Average and Other Data Set Fun With Kotlin;NaN;1;Eric N;The Startup;2020;7;8;data;3;51;0;https://medium.com/swlh/sum-average-and-other-data-set-fun-with-kotlin-3c906855e5c?source=tag_archive---------15-----------------------;https://medium.com/@ericntd?source=tag_archive---------15-----------------------
Venturing into Data Analytics: Lusianas Story;Proudly presenting our first Friend in Data, and a member in our Tech For She;1;Kay Liew;techforshe;2020;7;8;data;6;0;0;https://medium.com/tech4she/venturing-into-data-analytics-lusianas-story-6810270bdffe?source=tag_archive---------16-----------------------;https://medium.com/@liewyeekay?source=tag_archive---------16-----------------------
Collecting and Organizing Data for Maximum Productivity;NaN;1;Carl Pullein;The Working With  Magazine;2020;7;8;data;5;17;0;https://medium.com/carl-pullein/collecting-and-organizing-data-for-maximum-productivity-eff4bec08dcf?source=tag_archive---------17-----------------------;https://medium.com/@carl-pullein?source=tag_archive---------17-----------------------
Ten Data Commandments;While we may not to be in the room where analytics happens, we can be satisfied;1;Joshua Wu, PhD;NaN;2020;7;8;data;2;0;0;https://medium.com/@reasonableresearch/ten-data-commandments-e39d10960f4e?source=tag_archive---------18-----------------------;https://medium.com/@reasonableresearch?source=tag_archive---------18-----------------------
Business Intelligence or How to Make Your Data Work for You;NaN;1;Valeria Nesterovich;DataSeries;2020;7;8;data;4;7;0;https://medium.com/dataseries/business-intelligence-or-how-to-make-your-data-work-for-you-65ae478f3ec?source=tag_archive---------19-----------------------;https://medium.com/@valeria-celadon?source=tag_archive---------19-----------------------
Why are we so afraid of hard work?;The key findings summary of the special COVID-19 edition of the Culture Track report has been;1;Ceci Dadisman;We Are Arts Marketers;2020;7;8;data;3;0;0;https://medium.com/ceci-dadisman/why-are-we-so-afraid-of-hard-work-65c9068d4d93?source=tag_archive---------20-----------------------;https://medium.com/@cecidadisman?source=tag_archive---------20-----------------------
Interview with Greg LaBlanc: Data Strategy Summer Research Program;NaN;1;HarmonyPlus;NaN;2020;7;8;data;2;0;0;https://medium.com/@harmonyplusus/interview-with-greg-lablanc-data-strategy-summer-research-program-eb0b6a3eaace?source=tag_archive---------21-----------------------;https://medium.com/@harmonyplusus?source=tag_archive---------21-----------------------
Challenges with Integrated Care Delivery Model;The fragmented and non-navigable care delivery system in India and many other;1;Rajesh Verma;NaN;2020;7;8;data;4;0;0;https://medium.com/@rajvermausa/challenges-with-integrated-care-delivery-model-be6dd34f6f4f?source=tag_archive---------22-----------------------;https://medium.com/@rajvermausa?source=tag_archive---------22-----------------------
Introducing: ML No Code Academy 101;Having a resource bank of webinars, examples and how-tos has;1;Datagran;NaN;2020;7;8;data;2;0;0;https://medium.com/@datagran/introducing-ml-no-code-academy-101-d5f558e0c981?source=tag_archive---------23-----------------------;https://medium.com/@datagran?source=tag_archive---------23-----------------------
Regression analysis for business;Regression models are the first step into Machine Learning.;1;Datagran;NaN;2020;7;8;data;3;0;0;https://medium.com/@datagran/regression-analysis-for-business-d467ae045fba?source=tag_archive---------24-----------------------;https://medium.com/@datagran?source=tag_archive---------24-----------------------
The 10 U.S. Police Departments With The Highest Police Homicide Rates;One thing you can say about 2020 is that there hasnt been a dull moment since the year started, for good or for bad. Although lately it has been far more bad than good. One of the biggest things to happen this;0;Sylvia Powell;NaN;2020;7;8;data;2;37;0;https://medium.com/@sylviapowellnd/the-10-u-s-police-departments-with-the-highest-police-homicide-rates-3de24e77adda?source=tag_archive---------25-----------------------;https://medium.com/@sylviapowellnd?source=tag_archive---------25-----------------------
7 Ways to Effectively Use Big Data in Content Marketing Strategy;NaN;1;Seamfix;NaN;2020;7;8;data;6;0;0;https://medium.com/@seamfix/7-ways-to-effectively-use-big-data-in-content-marketing-strategy-fc59c21cd440?source=tag_archive---------26-----------------------;https://medium.com/@seamfix?source=tag_archive---------26-----------------------
Redis Transactions & Long-Running Lua Scripts;Redis offers two mechanisms for handling transactionsMULTI/EXEC based;1;Kristi Anderson;NaN;2020;7;8;data;5;0;0;https://medium.com/@kristi.anderson/redis-transactions-long-running-lua-scripts-6ddb91207e6?source=tag_archive---------27-----------------------;https://medium.com/@kristi.anderson?source=tag_archive---------27-----------------------
Great article! Loved how you introduced different techniques for different data types (numerical, categorical, text).;The introduction could use a bit more clarity as some people (including myself, embarrassingly) might not be familiar with the term feature engineering. Copying and pasting the highlighted sentence from the;0;Kristen Phan;NaN;2020;7;8;data;1;1;1;https://towardsdatascience.com/feature-engineering-3a380ad1aa36?source=tag_archive---------28-----------------------#2412;https://medium.com/@kristenphan?source=tag_archive---------28-----------------------
NaN;On Wednesday July 1 my firm Bellatrix Group hosted our first ever virtual panel, part of a three part series we are hosting on Health + Human Connectedness We were thrilled to have;1;Pamela Raitt;NaN;2020;7;8;data;2;0;0;https://medium.com/@pamelaraitt/on-wednesday-july-1-my-firm-bellatrix-group-hosted-our-first-ever-virtual-panel-part-of-a-three-348627286c39?source=tag_archive---------29-----------------------;https://medium.com/@pamelaraitt?source=tag_archive---------29-----------------------
Cognitive Load Theory and Data Literacy;Can a better understanding of Cognitive Load Theory lead to;1;Ali Allage;NaN;2020;7;8;data;5;0;0;https://medium.com/@aliallage/cognitive-load-theory-and-data-literacy-9da45079877f?source=tag_archive---------30-----------------------;https://medium.com/@aliallage?source=tag_archive---------30-----------------------
Data Driven Project ManagementSeries 2;Data Driven Project ManagementSeries 2;0;Raja Kumar;NaN;2020;7;8;data;2;0;0;https://medium.com/@rajaws1977/data-driven-project-management-series-2-ffe932cead20?source=tag_archive---------31-----------------------;https://medium.com/@rajaws1977?source=tag_archive---------31-----------------------
Ways AI can help control racism;Imagine that your companys HR director is able to analyze an AIs model outcome that shows patterns on;1;Datagran;NaN;2020;7;8;data;3;0;0;https://medium.com/@datagran/ways-ai-can-help-control-racism-5bc6845f7476?source=tag_archive---------32-----------------------;https://medium.com/@datagran?source=tag_archive---------32-----------------------
Patient Data Access is Self-Correcting;The eternal struggle of managing EHRs lies in ensuring that they contain consistent and;1;Todd Berner;NaN;2020;7;8;data;3;0;0;https://medium.com/@toddberner/patient-data-access-is-self-correcting-463c84fa26f?source=tag_archive---------33-----------------------;https://medium.com/@toddberner?source=tag_archive---------33-----------------------
Analytics And Data |   ;A;1;Deetalkindia;NaN;2020;7;8;data;2;0;0;https://medium.com/@deetalkindia/analytics-and-data-%E0%A4%B5%E0%A4%BF%E0%A4%B6%E0%A5%8D%E0%A4%B2%E0%A5%87%E0%A4%B7%E0%A4%BF%E0%A4%95%E0%A5%80-%E0%A4%94%E0%A4%B0-%E0%A4%A1%E0%A5%87%E0%A4%9F%E0%A4%BE-d964d5008758?source=tag_archive---------34-----------------------;https://medium.com/@deetalkindia?source=tag_archive---------34-----------------------
Dynamic filtering in Power BI;Check this simple technique to avoid using buttons and bookmarks for;1;Nikola Ilic;Towards Data Science;2020;7;9;data;4;27;0;https://towardsdatascience.com/dynamic-filtering-in-power-bi-5a3e2d2c1856?source=tag_archive---------0-----------------------;https://towardsdatascience.com/@datamozart?source=tag_archive---------0-----------------------
New Data Shows a Lower Covid-19 Fatality Rate;New Data and Analysis Offers More AccuracyIt Shows a;1;Steve McConnell;Towards Data Science;2020;7;9;data;13;161;0;https://towardsdatascience.com/new-data-shows-a-lower-covid-19-fatality-rate-1d69361a50af?source=tag_archive---------1-----------------------;https://towardsdatascience.com/@stevemcc?source=tag_archive---------1-----------------------
Download TikToks With Python;This story navigates readers through how to setup a simple python script;1;David Teather;Analytics Vidhya;2020;7;9;data;4;2;0;https://medium.com/analytics-vidhya/download-tiktoks-with-python-dcbd79a5237f?source=tag_archive---------2-----------------------;https://medium.com/@david.teather?source=tag_archive---------2-----------------------
Red Wine Quality Prediction using Classification and Regression Model;NaN;1;Chinwendu Onukogu;Dev Genius;2020;7;9;data;8;6;0;https://medium.com/dev-genius/red-wine-quality-prediction-using-classification-and-regression-model-f19337821b71?source=tag_archive---------3-----------------------;https://medium.com/@chinweee?source=tag_archive---------3-----------------------
How to Integrate SQL Databases with Snowflake Using AWS Glue;Going Cloud-Native for Data Integration;1;Venkat Sekar;HashmapInc;2020;7;9;data;8;15;0;https://medium.com/hashmapinc/how-to-integrate-sql-databases-with-snowflake-using-aws-glue-12e78339b251?source=tag_archive---------4-----------------------;https://medium.com/@venkatesh.sekar_56341?source=tag_archive---------4-----------------------
Making Your Data Room Pop!;The Art of the Data Room is Important When Fundraising;1;Jasmine Crowe;NaN;2020;7;9;data;9;90;0;https://medium.com/@jasminecrowe_54/making-your-data-room-pop-fbcb95e5aaf5?source=tag_archive---------5-----------------------;https://medium.com/@jasminecrowe_54?source=tag_archive---------5-----------------------
Retrieving flight logs for DJI, Autel and other drones using Airdata;NaN;1;Hivemapper;The Official Hivemapper Blog;2020;7;9;data;5;2;0;https://blog.hivemapper.com/retrieving-flight-logs-for-dji-autel-and-other-drones-using-airdata-280079a9621d?source=tag_archive---------6-----------------------;https://blog.hivemapper.com/@Hivemapper?source=tag_archive---------6-----------------------
NaN;NaN;1;Priyanka Vergadia;Google Cloud Community;2020;7;9;data;4;288;0;https://medium.com/google-cloud/how-can-google-cloud-help-with-security-of-your-apps-8f5692f56177?source=tag_archive---------7-----------------------;https://medium.com/@pvergadia?source=tag_archive---------7-----------------------
Understanding TPC-H and TPC-E Performance Benchmarks;NaN;1;Nuzhi Meyen;NaN;2020;7;9;data;3;0;0;https://medium.com/@nmeyen/understanding-tpc-h-and-tpc-e-performance-benchmarks-d6da686dc769?source=tag_archive---------8-----------------------;https://medium.com/@nmeyen?source=tag_archive---------8-----------------------
Data Tending to Infinity;Niket Jain;1;SEDS-VIT;NaN;2020;7;9;data;4;353;0;https://medium.com/@sedsvit/data-trending-to-infinity-711520727af2?source=tag_archive---------9-----------------------;https://medium.com/@sedsvit?source=tag_archive---------9-----------------------
Things We : Covid Act Now Map;There are lots of numbers floating around these days in relation to COVID-19. Weve written before about;1;CommunicateHealth;wehearthealthliteracy;2020;7;9;data;2;0;0;https://medium.com/wehearthealthliteracy/things-we-covid-act-now-map-98dcbc73429d?source=tag_archive---------10-----------------------;https://medium.com/@whhl?source=tag_archive---------10-----------------------
How much Data is generated every day?;The amount of data we create is mind-boggling. We create around 2.5 quintillion bytes of data each day, that is a huge number! To put that into perspective that is equal to 2.5 million Terabytes. It is predicted that the average person is expected to generate 1.7;0;Amogh Sondur;NaN;2020;7;9;data;2;0;0;https://medium.com/@amoghvs/how-much-data-is-generated-every-day-b94af8bcef4b?source=tag_archive---------11-----------------------;https://medium.com/@amoghvs?source=tag_archive---------11-----------------------
Data-backed articles on American policing and race;What data says about an injustice;1;John Clements;Towards Data Science;2020;7;9;data;3;16;0;https://towardsdatascience.com/data-backed-articles-on-american-policing-and-race-75f74f08afa2?source=tag_archive---------12-----------------------;https://towardsdatascience.com/@jkclements2016?source=tag_archive---------12-----------------------
Dissertation Update: A Mini-Eureka Moment!;As some of you know, I have been writing my masters dissertation on why Canada lacks;1;Matthew Pelletier;NaN;2020;7;9;data;4;1;0;https://medium.com/@matthewjamespelletier/dissertation-update-a-mini-eureka-moment-cd273d0cb014?source=tag_archive---------13-----------------------;https://medium.com/@matthewjamespelletier?source=tag_archive---------13-----------------------
Helping Democratize AI, A Call to Action;According to Gartners;1;Stuart Kasemeier;Towards AI;2020;7;9;data;5;97;0;https://medium.com/towards-artificial-intelligence/helping-democratize-ai-a-call-to-action-cab45e43b0ed?source=tag_archive---------14-----------------------;https://medium.com/@stuart.kasemeier?source=tag_archive---------14-----------------------
TEXTHERO;Linking Pandas and Natural Language Processing(NLP) like never before.;1;Maheep Chaudhary;NaN;2020;7;9;data;3;228;0;https://medium.com/@chaudhary.maheep28/texthero-791f8c796ca9?source=tag_archive---------15-----------------------;https://medium.com/@chaudhary.maheep28?source=tag_archive---------15-----------------------
NaN;An Interview with Taruni Anand |;1;Vaibhav Gupta;Thorough and Unkempt;2020;7;9;data;7;2;0;https://medium.com/thorough-and-unkempt/an-important-part-of-data-related-problems-is-the-question-itself-66b92d54e2b0?source=tag_archive---------16-----------------------;https://medium.com/@vaibhavguptawho?source=tag_archive---------16-----------------------
Mozilla  AI ;Mozilla  Raegan MacDonald;1;Mozilla Taiwan;NaN;2020;7;9;data;4;0;0;https://medium.com/@moz2000tw/mozilla-%E6%8F%90%E4%BA%A4%E6%84%8F%E8%A6%8B%E6%9B%B8-%E5%9B%9E%E6%87%89%E6%AD%90%E7%9B%9F%E5%9F%B7%E5%A7%94%E6%9C%83%E6%96%B0-ai-%E8%8D%89%E6%A1%88%E7%9A%84%E5%85%AC%E9%96%8B%E5%BE%B5%E8%A9%A2-93f81a702166?source=tag_archive---------17-----------------------;https://medium.com/@moz2000tw?source=tag_archive---------17-----------------------
