Title;Subtitle;Image;Author;Publication;Year;Month;Day;Tag;Reading_Time;Claps;Comment;url;Author_urlBacktesting Basics: Four biases to know by heart;NaN;1;Auquan;auquan;2020;7;16;data;7;74;0;https://medium.com/auquan/backtesting-basics-four-biases-to-know-by-heart-cec3f62a11b4?source=tag_archive---------4-----------------------;https://medium.com/@AuquanTeam?source=tag_archive---------4-----------------------
Data Analyst 3.0: The Next Evolution of Data Workflows;With cloud-native data warehouses & advancements in augmented analytics, were entering the third phase of BI;0;Sid Sharma;Towards Data Science;2020;7;16;data;8;270;0;https://towardsdatascience.com/data-analyst-3-0-the-next-evolution-of-data-workflows-3f5939dd9b0a?source=tag_archive---------5-----------------------;https://towardsdatascience.com/@sharma.sadavath?source=tag_archive---------5-----------------------
Para que me sirve la Desviacin estndar?;Todos la calculamos pero en realidad para que me sirve?;1;Norman Vicente;NaN;2020;7;16;data;3;1;0;https://medium.com/@normanaspx/para-que-me-sirve-la-desviaci%C3%B3n-est%C3%A1ndar-7ca48c47947?source=tag_archive---------6-----------------------;https://medium.com/@normanaspx?source=tag_archive---------6-----------------------
Quick one on our attitudes to data;I find a lot of the responses to this tweet by Tunde Leye to be indicative of the kind of society;1;Cheta Nwanze;NaN;2020;7;16;data;3;12;0;https://medium.com/@chxta/quick-one-on-our-attitudes-to-data-9368d774e8c7?source=tag_archive---------7-----------------------;https://medium.com/@chxta?source=tag_archive---------7-----------------------
Building a better Family Information Service;This project is challenging the sector to think about;1;Britt Wood;FutureGov;2020;7;16;data;4;3;0;https://blog.wearefuturegov.com/building-a-better-family-information-service-a40b744f3bbb?source=tag_archive---------8-----------------------;https://blog.wearefuturegov.com/@brizzlecharlie?source=tag_archive---------8-----------------------
First COVIDaction Applicant Funded via Data Challenge;Africa CCVI shines a light on the most;1;Mike Klein;COVIDaction;2020;7;16;data;4;7;0;https://medium.com/covidaction/first-covidaction-applicant-funded-via-data-challenge-leverages-innovative-uses-of-data-to-save-d1ef95939259?source=tag_archive---------9-----------------------;https://medium.com/@mikefklein?source=tag_archive---------9-----------------------
Data. Ecosystem. Market design?;What is the whole-of-market design for data-sharing?;1;Gavin Starks;NaN;2020;7;16;data;2;71;0;https://medium.com/@agentgav/data-ecosystem-market-design-a8a27c7a120a?source=tag_archive---------10-----------------------;https://medium.com/@agentgav?source=tag_archive---------10-----------------------
Introducing Kiwis: Data Wrangling Toolkit in JavaScript ;NaN;1;Tom F vrier;JavaScript In Plain English;2020;7;16;data;3;4;0;https://medium.com/javascript-in-plain-english/introducing-kiwis-data-wrangling-toolkit-in-javascript-fdf1d54adc01?source=tag_archive---------11-----------------------;https://medium.com/@tomfevrier?source=tag_archive---------11-----------------------
Wisdom is nothing more than new data. Wisdom is definitely not a pinnacle;NaN;1;Tony Fish;NaN;2020;7;16;data;6;0;0;https://medium.com/@tonyfish/wisdom-is-nothing-more-than-new-data-wisdom-is-definitely-not-a-pinnacle-9d4e172f1918?source=tag_archive---------12-----------------------;https://medium.com/@tonyfish?source=tag_archive---------12-----------------------
O grande muro do mercado de dados;OBS: Artigo criado por Andr Sionek (Engenheiro de Dados e trabalha na Gousto, em Londres);1;How Education;NaN;2020;7;16;data;7;12;0;https://medium.com/@howeducation/o-grande-muro-do-mercado-de-dados-b876c3694cb4?source=tag_archive---------13-----------------------;https://medium.com/@howeducation?source=tag_archive---------13-----------------------
(Geo)Data Science avec PythonLe parcours du dbutantPartie 1Intrts;Ou pourquoi et comment;1;Aurelienchaumet;NaN;2020;7;16;data;8;0;0;https://medium.com/@aurelienchaumet/geo-data-science-avec-python-le-parcours-du-d%C3%A9butant-partie-1-int%C3%A9r%C3%AAts-12dc7b260fa9?source=tag_archive---------14-----------------------;https://medium.com/@aurelienchaumet?source=tag_archive---------14-----------------------
The Price of Coronavirus on the Festival Season: We Have the Report;We measured the pandemics;1;Kristian Gorenc;Viberate;2020;7;16;data;3;705;0;https://medium.com/viberate-blog/the-price-of-coronavirus-on-the-festival-season-we-have-the-report-10160c69be76?source=tag_archive---------15-----------------------;https://medium.com/@kristiangorenc?source=tag_archive---------15-----------------------
Statistics;Numbers dont lie;1;Bhanu Soni;The Startup;2020;7;16;data;5;404;0;https://medium.com/swlh/statistics-891348cfbb06?source=tag_archive---------16-----------------------;https://medium.com/@sonibhanu06?source=tag_archive---------16-----------------------
Ethics Havent Evolved in Big Tech and People Dont Really Care;They think they value virtuous social;1;Kyle O Brien;Better Programming;2020;7;16;data;6;52;0;https://medium.com/better-programming/ethics-havent-evolved-in-big-tech-people-don-t-really-care-4d09005edf4d?source=tag_archive---------17-----------------------;https://medium.com/@kyleobrien_uk?source=tag_archive---------17-----------------------
Power BI Challenge 3HR Data Insights Wrap Up!;NaN;1;Enterprise DNA;NaN;2020;7;16;data;5;1;0;https://medium.com/@sam.mckay/power-bi-challenge-3-hr-data-insights-wrap-up-7bb6d85a963a?source=tag_archive---------18-----------------------;https://medium.com/@sam.mckay?source=tag_archive---------18-----------------------
Why the Athleisure Market is Booming;A case study into why activewear brands are growing at the;1;Made Lapuerta;DASHION;2020;7;16;data;3;2;0;https://medium.com/dashion/why-the-athleisure-market-is-booming-b780bd9b558e?source=tag_archive---------19-----------------------;https://medium.com/@madebymade?source=tag_archive---------19-----------------------
PDF to CSV with Python;The Oklahoma Medical Marijuana Authority currently reports 1,407 registered medical cannabis processors active within;1;andrew reeves;NaN;2020;7;16;data;2;0;0;https://medium.com/@areeves9/pdf-to-csv-with-python-95abbf0b8b5d?source=tag_archive---------20-----------------------;https://medium.com/@areeves9?source=tag_archive---------20-----------------------
How to write your own R package and publish it on CRAN;NaN;1;Methods Bites;NaN;2020;7;16;data;29;0;0;https://medium.com/@methods_bites/how-to-write-your-own-r-package-and-publish-it-on-cran-6363ea3b11f1?source=tag_archive---------21-----------------------;https://medium.com/@methods_bites?source=tag_archive---------21-----------------------
Combining Data From Two Websites in Google Data StudioArekibo blog;Weve had a few requests;1;Arekibo Communications;NaN;2020;7;16;data;5;0;0;https://medium.com/@arekibo/combining-data-from-two-websites-in-google-data-studio-arekibo-blog-c4222aa128da?source=tag_archive---------22-----------------------;https://medium.com/@arekibo?source=tag_archive---------22-----------------------
Building a collective brain;Establishing the right long-term MDM strategy can lead to massive;1;Jose Romero;The Current by Slalom Florida;2020;7;16;data;4;2;0;https://medium.com/the-current-by-slalom-florida/master-data-management-as-an-enterprise-asset-c831cb70b98f?source=tag_archive---------23-----------------------;https://medium.com/@jose.romero_79606?source=tag_archive---------23-----------------------
Apa Itu Data Science?;Si Budi pemilik restoran yang memiliki cabang di Semarang dan Bali, tiap bulan;1;MIK;NaN;2020;7;16;data;2;1;0;https://medium.com/@iqbalytic/apa-itu-data-science-708d1b4b0d86?source=tag_archive---------24-----------------------;https://medium.com/@iqbalytic?source=tag_archive---------24-----------------------
NaN;NaN;0;Rukmini S;NaN;2020;7;16;data;1;2;0;https://medium.com/@rukminiwrites/episode-83-the-observer-effect-f7fe08929032?source=tag_archive---------25-----------------------;https://medium.com/@rukminiwrites?source=tag_archive---------25-----------------------
The Next-Generation Data Bank;Our digital lives have been hijacked by tech giants, who own and control;1;Chikwendu C Okenwa;NaN;2020;7;16;data;6;150;0;https://medium.com/@c-okenwa/the-next-generation-data-bank-2a076e9dd2f0?source=tag_archive---------26-----------------------;https://medium.com/@c-okenwa?source=tag_archive---------26-----------------------
Equinix Announces New Plans to Open Flagship Data Center In Milan;NaN;1;Shirin Sadr;Data Centre Magazine;2020;7;16;data;2;0;0;https://medium.com/data-centre-magazine/equinix-announces-new-plans-to-open-flagship-data-center-in-milan-96116e1a75f0?source=tag_archive---------27-----------------------;https://medium.com/@shirin.sadr?source=tag_archive---------27-----------------------
SQLs componentsDDL, DML, DCL and TCL;Although the vendors of relational database management system have their own implemented;1;Stefano Meloccaro;NaN;2020;7;16;data;8;0;0;https://medium.com/@melste1/sqls-components-ddl-dml-dcl-and-tcl-61ac86cd7b13?source=tag_archive---------28-----------------------;https://medium.com/@melste1?source=tag_archive---------28-----------------------
Why Your Analytics Should Include X Data;To truly understand and improve business performance;1;Gericksen;MODE/X;2020;7;16;data;3;68;0;https://medium.com/modex/why-your-analytics-should-include-x-data-f55f0a2ba14a?source=tag_archive---------29-----------------------;https://medium.com/@gericksen?source=tag_archive---------29-----------------------
HOW DOES CULTURE IMPACT MARKETING STRATEGIES;Syed Mahasin ujair G;1;Soven Developer;NaN;2020;7;16;data;3;6;0;https://medium.com/@sovendeveloper/how-does-culture-affect-marketing-strategies-e88e4be5fa42?source=tag_archive---------30-----------------------;https://medium.com/@sovendeveloper?source=tag_archive---------30-----------------------
How to Grow Your Business Using Multivariate Analysis Techniques;NaN;1;Global Article;NaN;2020;7;16;data;3;0;0;https://medium.com/@copprtdavid/how-to-grow-your-business-using-multivariate-analysis-techniques-3d8d24e2ebb6?source=tag_archive---------31-----------------------;https://medium.com/@copprtdavid?source=tag_archive---------31-----------------------
How Recognizing the Value of Data Can Benefit Companies in the Middle East;NaN;1;HB Marketing;NaN;2020;7;16;data;3;1;0;https://medium.com/@Hbmarketing/how-recognizing-the-value-of-data-can-benefit-companies-in-the-middle-east-dd216a1dbc46?source=tag_archive---------32-----------------------;https://medium.com/@Hbmarketing?source=tag_archive---------32-----------------------
Carta a un joven Data Scientist;10 pequeas observaciones que fui escribiendo en este largo camino de principiante a experto (dicho sea;1;Robertx;NaN;2020;7;16;data;4;0;0;https://medium.com/@robertx/carta-a-un-joven-data-scientist-76f63c8b0433?source=tag_archive---------33-----------------------;https://medium.com/@robertx?source=tag_archive---------33-----------------------
All you need to know about Excel vs. Data Warehousing;Author: Vivian Truong;1;CloudADDIE;NaN;2020;7;16;data;2;0;0;https://medium.com/@cloudaddie/all-you-need-to-know-about-excel-vs-data-warehousing-e87dd066963e?source=tag_archive---------34-----------------------;https://medium.com/@cloudaddie?source=tag_archive---------34-----------------------
Private Fund Data Operations Should Provide More Protection;COVID-19 has hit business leaders. Its;1;ReadWrite;ReadWrite;2020;7;16;data;4;0;0;https://medium.com/readwrite/private-fund-data-operations-should-provide-more-protection-15dc5342242b?source=tag_archive---------35-----------------------;https://medium.com/@RWW?source=tag_archive---------35-----------------------
Product Management and Hamilton the Musical: the mashup you never knew you needed;NaN;1;Randi De La Cruz-Johnson;NaN;2020;7;16;data;5;0;0;https://medium.com/@randidlcj/product-management-and-hamilton-the-musical-the-mashup-you-never-knew-you-needed-768ad6628f15?source=tag_archive---------36-----------------------;https://medium.com/@randidlcj?source=tag_archive---------36-----------------------
Doing more with Data;Digital transformation is less about technology and more about people. Technology is always about doing more with less, yet that combination is effective only if you pair technology with the right human skills. If we can leverage human adaptability, then we can simultaneously augment humans;0;Rahul Nayak;NaN;2020;7;16;data;2;0;0;https://medium.com/@rahulnayakuse/doing-more-with-data-762e48fe99f1?source=tag_archive---------37-----------------------;https://medium.com/@rahulnayakuse?source=tag_archive---------37-----------------------
How GDPR ready is your organization?;The GDPR is a huge piece of legislation. Where does an organization start? We brought together;1;Sanchita Dey;NaN;2020;7;16;data;5;0;0;https://medium.com/@trainers_932/how-gdpr-ready-is-your-organization-139c19830593?source=tag_archive---------38-----------------------;https://medium.com/@trainers_932?source=tag_archive---------38-----------------------
How Data and AI will Shape the Post-Pandemic Future;The power of a million scientists;1;Enterprise.nxt;Enterprise.nxt;2020;7;16;data;5;0;0;https://medium.com/enterprise-nxt/how-data-and-ai-will-shape-the-post-pandemic-future-55ad265212bf?source=tag_archive---------39-----------------------;https://medium.com/@enterprisenxt?source=tag_archive---------39-----------------------
#Data4COVID19 Round-Up: 16 July;This week, the Summer of Open Data, a testing target dashboard, and a;1;Andrew J. Zahuranec;Data Stewards Network;2020;7;16;data;3;0;0;https://medium.com/data-stewards-network/data4covid19-round-up-16-july-114f1f6d8d6e?source=tag_archive---------40-----------------------;https://medium.com/@ajzahuranec?source=tag_archive---------40-----------------------
Helping Customers to Plan and Create a Declared Data Strategy;NaN;1;Victor Maia;SaaSholic;2020;7;16;data;9;0;0;https://saasholic.com/helping-customers-to-plan-and-create-a-declared-data-strategy-33603645d847?source=tag_archive---------41-----------------------;https://saasholic.com/@victormaiam?source=tag_archive---------41-----------------------
AskGEO: Tool For Recommending GEO StudiesElucidata;NaN;1;Elucidata;Elucidata;2020;7;16;data;3;0;0;https://medium.com/elucidata/askgeo-tool-for-recommending-geo-studies-elucidata-ccac5932044?source=tag_archive---------42-----------------------;https://medium.com/@elucidatainc?source=tag_archive---------42-----------------------
SCMP Webinar: Does data privacy protection mean the end for targeted advertising?;https://youtu.be/4GbrqQM5FbM;0;Ian Hocking;SCMP Digital Decoder;2020;7;16;data;0;0;0;https://medium.com/scmp-digital-decoder/scmp-webinar-does-data-privacy-protection-mean-the-end-for-targeted-advertising-d76464cbf25a?source=tag_archive---------43-----------------------;https://medium.com/@ian.hocking?source=tag_archive---------43-----------------------
What Does The Future of Data Look Like?;The long term management of data has only become a more complex problem over time, as has;1;Haihui Joy Jiang;NaN;2020;7;16;data;3;0;0;https://medium.com/@haihuijoyjiangphd/what-does-the-future-of-data-look-like-ca4925e766bd?source=tag_archive---------44-----------------------;https://medium.com/@haihuijoyjiangphd?source=tag_archive---------44-----------------------
5 Reasons to Consider Managing Inventory Data Outside Your ERP;NaN;1;Data Systems InternationalDSI );NaN;2020;7;16;data;3;23;0;https://medium.com/@datasystemsinternational/5-reasons-to-consider-managing-inventory-data-outside-your-erp-1302ea019a63?source=tag_archive---------45-----------------------;https://medium.com/@datasystemsinternational?source=tag_archive---------45-----------------------
NaN;NaN;0;Anupam Chugh;NaN;2020;7;16;data;0;0;1;https://medium.com/@jamesrcridland/perhaps-im-not-in-my-right-mind-but-doesn-t-personalised-ads-mean-i-ll-see-less-irrelevant-crap-208341007287?source=tag_archive---------46-----------------------;https://medium.com/@anupamchugh?source=tag_archive---------46-----------------------
Data The New Oil In Modern Technology;NaN;1;PromptCloud;NaN;2020;7;16;data;5;0;0;https://medium.com/@promptcloud20/data-the-new-oil-in-modern-technology-c2d370a1b2b8?source=tag_archive---------47-----------------------;https://medium.com/@promptcloud20?source=tag_archive---------47-----------------------
Indigenous dialogue;To celebrate the International Day of the Worlds Indigenous Peoples, I decided I would spend some time to try and;1;Andrew Bilsdon;NaN;2020;7;16;data;1;0;0;https://medium.com/@abilsdon/indigenous-dialogue-2db9f62a2e94?source=tag_archive---------48-----------------------;https://medium.com/@abilsdon?source=tag_archive---------48-----------------------
Pourquoi les contrats lectricit 100% verte ne fournissent-ils pas uniquement de llectricit verte ?;NaN;1;Barry Energy France;NaN;2020;7;16;data;4;0;0;https://medium.com/@barry-energy-fr/pourquoi-les-contrats-%C3%A9lectricit%C3%A9-100-verte-ne-fournissent-ils-pas-uniquement-de-l%C3%A9lectricit%C3%A9-c864b2cf2697?source=tag_archive---------49-----------------------;https://medium.com/@barry-energy-fr?source=tag_archive---------49-----------------------
The Best Mario Kart 8 Character, According to Data Science;Wheels up!;1;Navya Annapareddy;Towards Data Science;2020;7;17;data;4;57;0;https://towardsdatascience.com/the-best-mario-kart-8-character-according-to-data-science-d300dd7a645a?source=tag_archive---------0-----------------------;https://towardsdatascience.com/@ncanna?source=tag_archive---------0-----------------------
Thousands of Companies Send Your Data to Facebook Without Your Knowledge;But you can do something;1;Thomas Smith;OneZero;2020;7;17;data;10;752;0;https://onezero.medium.com/doordash-and-thousands-of-other-companies-passively-send-your-data-to-facebook-4ebe851e710?source=tag_archive---------1-----------------------;https://onezero.medium.com/@tomsmith585?source=tag_archive---------1-----------------------
The Adventure of PDF to Data Frame in R.;PDFs can present a challenge for data scientists. Here is a;1;Justin Cocco;The Startup;2020;7;17;data;9;151;0;https://medium.com/swlh/the-adventure-of-pdf-to-data-frame-in-r-f90609035600?source=tag_archive---------2-----------------------;https://medium.com/@justincocco?source=tag_archive---------2-----------------------
What is Data Reliability?;And how to use it to start trusting your data.;1;Barr Moses;Towards Data Science;2020;7;17;data;6;63;0;https://towardsdatascience.com/what-is-data-reliability-66ec88578950?source=tag_archive---------3-----------------------;https://towardsdatascience.com/@barrmoses?source=tag_archive---------3-----------------------
Can Kompresso get 9 Bars of Pressure for Espresso?;Exploring Kompresso with a Simple Experiment;0;Robert McKeon Aloe;Towards Data Science;2020;7;17;data;4;3;0;https://towardsdatascience.com/can-kompresso-get-9-bars-of-pressure-for-espresso-9aeff301b943?source=tag_archive---------4-----------------------;https://towardsdatascience.com/@rmckeon?source=tag_archive---------4-----------------------
SQL;NaN;0;Bess Chen;NaN;2020;7;17;data;6;29;0;https://medium.com/@b01703030/%E8%B2%A1%E5%8B%99%E4%BA%BA%E7%9A%84sql%E5%AD%B8%E7%BF%92%E4%B9%8B%E8%B7%AF-dadb83a01b03?source=tag_archive---------5-----------------------;https://medium.com/@b01703030?source=tag_archive---------5-----------------------
Le Modle dObjets Mtier : quest-ce que cest et  quoi a sert ?Partie 1;Ou comment dcrire le;1;Pramana;NaN;2020;7;17;data;5;2;0;https://medium.com/@pramanaconseil/le-mod%C3%A8le-dobjets-m%C3%A9tier-qu-est-ce-que-c-est-et-%C3%A0-quoi-%C3%A7a-sert-partie-1-22a186aa25cc?source=tag_archive---------6-----------------------;https://medium.com/@pramanaconseil?source=tag_archive---------6-----------------------
Powerful ParametersHow to Dynamically Swap Metrics and Limit Data Points in Tableau;NaN;1;Aasavari Kaley;The Startup;2020;7;17;data;6;82;0;https://medium.com/swlh/powerful-parameters-how-to-dynamically-swap-metrics-and-change-data-points-in-tableau-30bbc2c3fe16?source=tag_archive---------7-----------------------;https://medium.com/@aasavari-kaley?source=tag_archive---------7-----------------------
Simeone, a muralha colchonera e o Cholismo;Por dentro dos nmeros defensivos, coletivos e;1;Daniel Endebo;Data FC;2020;7;17;data;11;13;0;https://medium.com/data-fc/simeone-a-muralha-colchonera-e-o-cholismo-39b8ac569af3?source=tag_archive---------8-----------------------;https://medium.com/@danielendebo?source=tag_archive---------8-----------------------
BetProtocol Partners with Band Protocol for Esports & Sports Betting Data Oracles;NaN;1;BetProtocol;NaN;2020;7;17;data;5;456;0;https://medium.com/@betprotocol/betprotocol-partners-with-band-protocol-for-esports-sports-betting-data-oracles-f6ab9dad98ab?source=tag_archive---------9-----------------------;https://medium.com/@betprotocol?source=tag_archive---------9-----------------------
The European Court of Justice (CJEU) Just Invalidated Privacy Shield;Understand the key CJEU court;1;Travis Greene;The Startup;2020;7;17;data;11;52;0;https://medium.com/swlh/so-the-european-court-of-justice-cjeu-just-invalidated-the-privacy-shield-agreement-with-the-us-204bdd2fefd?source=tag_archive---------10-----------------------;https://medium.com/@datasophy?source=tag_archive---------10-----------------------
Rules to Building an AI SystemFrom a Data Scientist;AI Systems are just as important as design;1;Jerry Buaba;Downsample;2020;7;17;data;7;1.6K;0;https://medium.com/downsample/rules-to-building-an-ai-system-from-a-data-scientist-f39d303d7d79?source=tag_archive---------11-----------------------;https://medium.com/@buabajerry?source=tag_archive---------11-----------------------
Design for intelligence: data x digital product design;Being data proficient is no longer optional for;1;Fergie Leung;UX Collective;2020;7;17;data;5;78;0;https://uxdesign.cc/design-for-intelligence-data-x-digital-product-design-a37b7d92c5a8?source=tag_archive---------12-----------------------;https://uxdesign.cc/@fergieleung?source=tag_archive---------12-----------------------
NaN;NaN;1;Amit Rawal;NaN;2020;7;17;data;7;305;0;https://medium.com/@amitrawal/the-future-of-analytics-ce5c8fc37039?source=tag_archive---------13-----------------------;https://medium.com/@amitrawal?source=tag_archive---------13-----------------------
Judging a Face Value: AI and Physiognomy;Physiognomys New Clothes;1;Yunee Ham;Noteworthy The Journal Blog;2020;7;17;data;2;162;0;https://blog.usejournal.com/ai-and-physiognomy-153e875d3238?source=tag_archive---------14-----------------------;https://blog.usejournal.com/@yuneeh?source=tag_archive---------14-----------------------
SPLUNK;Herkese merhaba, bu yazda Splunktan bahsedeceim.;1; i dem Kadako lu;NaN;2020;7;17;data;7;107;0;https://medium.com/@cidokimi/splunk-d484502eb68e?source=tag_archive---------15-----------------------;https://medium.com/@cidokimi?source=tag_archive---------15-----------------------
8 things to keep in mind while designing Data heavy Applications on Azure;Best practices that you;1;Ali Abbas;NaN;2020;7;17;data;4;10;0;https://medium.com/@aliabbas.manager89/8-things-to-keep-in-mind-while-designing-data-heavy-applications-on-azure-4b377414e7fa?source=tag_archive---------16-----------------------;https://medium.com/@aliabbas.manager89?source=tag_archive---------16-----------------------
Updating Canadas Census : Better Data Means Better Decisions;We know that accurate, reliable data is;1;Navdeep Bains;NaN;2020;7;17;data;2;0;0;https://medium.com/@NavdeepSBains/updating-canadas-census-better-data-means-better-decisions-735b4f0b8212?source=tag_archive---------17-----------------------;https://medium.com/@NavdeepSBains?source=tag_archive---------17-----------------------
Why Your Meme Sucks, Part 5: STOP WHATABOUTISM;The offending post can be found here: ;1;Austen Montero;NaN;2020;7;17;data;5;0;0;https://medium.com/@austenmontero/why-your-meme-sucks-part-5-stop-whataboutism-e063417c4ea9?source=tag_archive---------18-----------------------;https://medium.com/@austenmontero?source=tag_archive---------18-----------------------
7 Data Paradoxes You Should Be Aware Of;NaN;1;Sergi Lehkyi;NaN;2020;7;17;data;11;6;0;https://medium.com/@sergilehkyi/7-data-paradoxes-you-should-be-aware-of-1e6fa81cdd19?source=tag_archive---------19-----------------------;https://medium.com/@sergilehkyi?source=tag_archive---------19-----------------------
Science Doesnt Stop when the Art Starts: 9 Steps to Equity & Ethics in Data Communication;NaN;1;Heather Krause;NaN;2020;7;17;data;6;1;0;https://medium.com/@heatherkrause/science-doesnt-stop-when-the-art-starts-9-steps-to-equity-ethics-in-data-communication-d87aaf0ac171?source=tag_archive---------20-----------------------;https://medium.com/@heatherkrause?source=tag_archive---------20-----------------------
Big Data;NaN;1;Hexaberry Data Science Community;NaN;2020;7;17;data;6;11;0;https://medium.com/@hexaberry.datasciencecommunity/big-data-7e99859cab4d?source=tag_archive---------21-----------------------;https://medium.com/@hexaberry.datasciencecommunity?source=tag_archive---------21-----------------------
SQL for Data Analytics-1;NaN;1;Nilay Chauhan;Data Stash;2020;7;17;data;5;25;0;https://medium.com/data-stash/sql-for-data-analytics-1-a595b914f1bc?source=tag_archive---------22-----------------------;https://medium.com/@nilaychauhan?source=tag_archive---------22-----------------------
